numero,nome,texto_ingles,traduzido
255,Creosote Heath,"Creosote Heath enters the battlefield tapped.
When Creosote Heath enters the battlefield, it deals 1 damage to target opponent.
{T}: Add {G} or {W}.","Charneca de Creosoto entra no campo de batalha virado.
Quando Creosoto Heath entra no campo de batalha, ele causa 1 ponto de dano ao oponente alvo.
{T}: Adicione {G} ou {W}."
256,Eroded Canyon,"Eroded Canyon enters the battlefield tapped.
When Eroded Canyon enters the battlefield, it deals 1 damage to target opponent.
{T}: Add {U} or {R}.","Cânion Erodido entra no campo de batalha virado.
Quando Eroded Canyon entra no campo de batalha, ele causa 1 ponto de dano ao oponente alvo.
{T}: Adicione {U} ou {R}."
257,Festering Gulch,"Festering Gulch enters the battlefield tapped.
When Festering Gulch enters the battlefield, it deals 1 damage to target opponent.
{T}: Add {B} or {G}.","Ravina Purulenta entra no campo de batalha virado.
Quando Festering Gulch entra no campo de batalha, ele causa 1 ponto de dano ao oponente alvo.
{T}: Adicione {B} ou {G}."
258,Forlorn Flats,"Forlorn Flats enters the battlefield tapped.
When Forlorn Flats enters the battlefield, it deals 1 damage to target opponent.
{T}: Add {W} or {B}.","Forlorn Flats entra no campo de batalha virado.
Quando Forlorn Flats entra no campo de batalha, ele causa 1 ponto de dano ao oponente alvo.
{T}: Adicione {W} ou {B}."
259,Jagged Barrens,"Jagged Barrens enters the battlefield tapped.
When Jagged Barrens enters the battlefield, it deals 1 damage to target opponent.
{T}: Add {B} or {R}.","Sertões Jagged entra no campo de batalha virado.
Quando Sertões Jagged entra no campo de batalha, ele causa 1 ponto de dano ao oponente alvo.
{T}: Adicione {B} ou {R}."
260,Lonely Arroyo,"Lonely Arroyo enters the battlefield tapped.
When Lonely Arroyo enters the battlefield, it deals 1 damage to target opponent.
{T}: Add {W} or {U}.","Lonely Arroyo entra no campo de batalha virado.
Quando Lonely Arroyo entra no campo de batalha, ele causa 1 ponto de dano ao oponente alvo.
{T}: Adicione {W} ou {U}."
261,Lush Oasis,"Lush Oasis enters the battlefield tapped.
When Lush Oasis enters the battlefield, it deals 1 damage to target opponent.
{T}: Add {G} or {U}.","Oásis Exuberante entra no campo de batalha virado.
Quando Lush Oasis entra no campo de batalha, ele causa 1 ponto de dano ao oponente alvo.
{T}: Adicione {G} ou {U}."
262,Mirage Mesa,"Mirage Mesa enters the battlefield tapped. As it enters, choose a color.
{T}: Add one mana of the chosen color.","Mirage Mesa entra no campo de batalha virada. Ao entrar, escolha uma cor.
{T}: Adicione um mana da cor escolhida."
263,Sandstorm Verge,"{T}: Add {C}.
{3}, {T}: Target creature can't block this turn. Activate only as a sorcery.","{T}: Adicione {C}.
{3}, {T}: A criatura alvo não pode bloquear neste turno. Ative apenas como um feitiço."
264,Soured Springs,"Soured Springs enters the battlefield tapped.
When Soured Springs enters the battlefield, it deals 1 damage to target opponent.
{T}: Add {U} or {B}.","Soured Springs entra no campo de batalha virado.
Quando Soured Springs entra no campo de batalha, ela causa 1 ponto de dano ao oponente alvo.
{T}: Adicione {U} ou {B}."
265,Bucolic Ranch,"{T}: Add {C}.
{T}: Add one mana of any color. Spend this mana only to cast a Mount spell.
{3}, {T}: Look at the top card of your library. If it's a Mount card, you may reveal it and put it into your hand. If you don't put it into your hand, you may put it on the bottom of your library.","{T}: Adicione {C}.
{T}: Adicione um mana de qualquer cor. Gaste este mana apenas para lançar um feitiço de Montaria.
{3}, {T}: Veja o card do topo do seu grimório. Se for uma carta de Montaria, você pode revelá-la e colocá-la em sua mão. Se você não colocá-lo em sua mão, poderá colocá-lo no fundo de seu grimório."
266,Blooming Marsh,"Blooming Marsh enters the battlefield tapped unless you control two or fewer other lands.
{T}: Add {B} or {G}.","Blooming Marsh entra no campo de batalha virado, a menos que você controle dois ou menos outros terrenos.
{T}: Adicione {B} ou {G}."
267,Botanical Sanctum,"Botanical Sanctum enters the battlefield tapped unless you control two or fewer other lands.
{T}: Add {G} or {U}.","Santuário Botânico entra no campo de batalha virado, a menos que você controle dois ou menos outros terrenos.
{T}: Adicione {G} ou {U}."
268,Concealed Courtyard,"Concealed Courtyard enters the battlefield tapped unless you control two or fewer other lands.
{T}: Add {W} or {B}.","Pátio Oculto entra no campo de batalha virado, a menos que você controle dois ou menos outros terrenos.
{T}: Adicione {W} ou {B}."
269,Inspiring Vantage,"Inspiring Vantage enters the battlefield tapped unless you control two or fewer other lands.
{T}: Add {R} or {W}.","Inspiring Vantage entra no campo de batalha virado, a menos que você controle dois ou menos outros terrenos.
{T}: Adicione {R} ou {W}."
270,Spirebluff Canal,"Spirebluff Canal enters the battlefield tapped unless you control two or fewer other lands.
{T}: Add {U} or {R}.","Spirebluff Canal entra no campo de batalha virado, a menos que você controle dois ou menos outros terrenos.
{T}: Adicione {U} ou {R}."
271,Jace Reawakened,"You can't cast this spell during your first, second, or third turns of the game.
+1: Draw a card, then discard a card.
+1: You may exile a nonland card with mana value 3 or less from your hand. If you do, it becomes plotted.
−6: Until end of turn, whenever you cast a spell, copy it. You may choose new targets for the copy.","Você não pode lançar esta magia durante o primeiro, segundo ou terceiro turno do jogo.
+1: Compre uma carta e depois descarte uma carta.
+1: Você pode exilar de sua mão um card que não seja um terreno com valor de mana igual ou inferior a 3. Se você fizer isso, isso será planejado.
−6: Até o final do turno, sempre que você conjurar uma mágica, copie-a. Você pode escolher novos alvos para a cópia."
287,"Geralf, the Fleshwright","Whenever you cast a spell during your turn other than your first spell that turn, create a 2/2 blue and black Zombie Rogue creature token.
Whenever a Zombie enters the battlefield under your control, put a +1/+1 counter on it for each other Zombie that entered the battlefield under your control this turn.","Toda vez que você conjurar uma mágica durante seu turno que não seja a primeira mágica daquele turno, crie uma ficha de criatura Zumbi Ladino azul e preta 2/2.
Toda vez que um Zumbi entrar no campo de batalha sob o seu controle, coloque nele um marcador +1/+1 para cada outro Zumbi que entrou no campo de batalha sob o seu controle neste turno."
288,"Gisa, the Hellraiser","Ward—{2}, Pay 2 life.
Skeletons and Zombies you control get +1/+1 and have menace.
Whenever you commit a crime, create two tapped 2/2 blue and black Zombie Rogue creature tokens. This ability triggers only once each turn. (Targeting opponents, anything they control, and/or cards in their graveyards is a crime.)","Ala—{2}, pague 2 pontos de vida.
Esqueletos e Zumbis que você controla recebem +1/+1 e têm ameaça.
Sempre que você cometer um crime, crie duas fichas de criatura Zumbi Ladino azuis e pretas 2/2 viradas. Esta habilidade é desencadeada apenas uma vez por turno. (Alvejar oponentes, qualquer coisa que eles controlem e/ou cards em seus cemitérios é crime.)"
289,"Kaervek, the Punisher","Whenever you commit a crime, exile up to one target black card from your graveyard and copy it. You may cast the copy. If you do, you lose 2 life. (Targeting opponents, anything they control, and/or cards in their graveyards is a crime. Copies of permanent spells become tokens.)","Sempre que você cometer um crime, exile até um card preto alvo de seu cemitério e copie-o. Você pode lançar a cópia. Se fizer isso, você perde 2 pontos de vida. (Alvejar oponentes, qualquer coisa que eles controlem e/ou cards em seus cemitérios é crime. Cópias de mágicas permanentes tornam-se fichas.)"
290,"Tinybones, the Pickpocket","Deathtouch
Whenever Tinybones, the Pickpocket deals combat damage to a player, you may cast target nonland permanent card from that player's graveyard, and mana of any type can be spent to cast that spell.","Toque da morte
Sempre que Tinybones, o Batedor de Carteiras, causa dano de combate a um jogador, você pode conjurar o card permanente alvo que não seja um terreno do cemitério daquele jogador, e qualquer tipo de mana pode ser gasto para conjurar aquela mágica."
291,"Annie Flash, the Veteran","Flash
When Annie Flash, the Veteran enters the battlefield, if you cast it, return target permanent card with mana value 3 or less from your graveyard to the battlefield tapped.
Whenever Annie Flash becomes tapped, exile the top two cards of your library. You may play those cards this turn.","Clarão
Quando Annie Flash, a Veterana, entrar no campo de batalha, se você a conjurou, devolva o card de permanente alvo com valor de mana igual ou inferior a 3 de seu cemitério para o campo de batalha virado.
Sempre que Annie Flash for virada, exile os dois cards do topo do seu grimório. Você pode jogar essas cartas neste turno."
292,"Breeches, the Blastmaker","Menace
Whenever you cast your second spell each turn, you may sacrifice an artifact. If you do, flip a coin. When you win the flip, copy that spell. You may choose new targets for the copy. When you lose the flip, Breeches, the Blastmaker deals damage equal to that spell's mana value to any target.","Ameaça
Sempre que você lançar seu segundo feitiço a cada turno, você poderá sacrificar um artefato. Se você fizer isso, jogue uma moeda. Quando você vencer, copie aquela mágica. Você pode escolher novos alvos para a cópia. Quando você perde o lance Calções, o Blastmaker causa dano igual ao valor de mana daquele feitiço a qualquer alvo."
293,"Eriette, the Beguiler","Lifelink
Whenever an Aura you control becomes attached to a nonland permanent an opponent controls with mana value less than or equal to that Aura's mana value, gain control of that permanent for as long as that Aura is attached to it.","Vínculo com a vida
Toda vez que uma Aura que você controla for anexada a uma permanente que não seja um terreno, um oponente controla com valor de mana menor ou igual ao valor de mana daquela Aura, ganhe o controle daquela permanente enquanto aquela Aura estiver anexada a ela."
294,"Kellan, the Kid","Flying, lifelink
Whenever you cast a spell from anywhere other than your hand, you may cast a permanent spell with equal or lesser mana value from your hand without paying its mana cost. If you don't, you may put a land card from your hand onto the battlefield.","Voando, vínculo vitalício
Sempre que você conjurar uma mágica de qualquer lugar que não seja sua mão, você poderá conjurar uma mágica permanente com valor de mana igual ou menor de sua mão sem pagar seu custo de mana. Caso contrário, você poderá colocar um card de terreno de sua mão no campo de batalha."
295,"Malcolm, the Eyes","Flying, haste
Whenever you cast your second spell each turn, investigate. (Create a Clue token. It's an artifact with ""{2}, Sacrifice this artifact: Draw a card."")","Voando, pressa
Sempre que você lançar seu segundo feitiço a cada turno, investigue. (Crie uma ficha de Pista. É um artefato com ""{2}, Sacrifique este artefato: Compre um card."")"
296,"Oko, the Ringleader","At the beginning of combat on your turn, Oko, the Ringleader becomes a copy of up to one target creature you control until end of turn, except he has hexproof.
+1: Draw two cards. If you've committed a crime this turn, discard a card. Otherwise, discard two cards.
−1: Create a 3/3 green Elk creature token.
−5: For each other nonland permanent you control, create a token that's a copy of that permanent.","No início do combate no seu turno, Oko, o Líder, torna-se uma cópia de até uma criatura alvo que você controla até o final do turno, exceto por ter resistência à magia.
+1: Compre duas cartas. Se você cometeu um crime neste turno, descarte uma carta. Caso contrário, descarte duas cartas.
−1: Crie uma ficha de criatura verde 3/3 do tipo Alce.
−5: Para cada outra permanente que você controla que não seja um terreno, crie uma ficha que seja uma cópia daquela permanente."
297,"Rakdos, the Muscle","Flying, trample
Whenever you sacrifice another creature, exile cards equal to its mana value from the top of target player's library. Until your next end step, you may play those cards, and mana of any type can be spent to cast those spells.
Sacrifice another creature: Rakdos, the Muscle gains indestructible until end of turn. Tap it. Activate only once each turn.","Voando, atropelar
Sempre que você sacrificar outra criatura, exile cards iguais ao seu valor de mana do topo do grimório do jogador alvo. Até sua próxima etapa final, você pode jogar esses cards e qualquer tipo de mana pode ser gasto para conjurar essas mágicas.
Sacrifique outra criatura: Rakdos, o Músculo, ganha indestrutível até o final do turno. Toque nele. Ative apenas uma vez em cada turno."
298,"Satoru, the Infiltrator","Menace
Whenever Satoru, the Infiltrator and/or one or more other nontoken creatures enter the battlefield under your control, if none of them were cast or no mana was spent to cast them, draw a card.","Ameaça
Toda vez que Satoru, o Infiltrador e/ou uma ou mais criaturas que não sejam fichas entrarem no campo de batalha sob seu controle, se nenhuma delas foi conjurada ou nenhuma mana foi gasta para conjurá-las, compre um card."
299,"Vraska, the Silencer","Deathtouch
Whenever a nontoken creature an opponent controls dies, you may pay {1}. If you do, return that card to the battlefield tapped under your control. It's a Treasure artifact with ""{T}, Sacrifice this artifact: Add one mana of any color,"" and it loses all other card types.","Toque da morte
Toda vez que uma criatura que não seja uma ficha que um oponente controla morrer, você poderá pagar {1}. Se fizer isso, devolva aquele card ao campo de batalha virado sob seu controle. É um artefato Tesouro com ""{T}, sacrifique este artefato: Adicione um mana de qualquer cor"" e perde todos os outros tipos de card."
300,Blooming Marsh,"Blooming Marsh enters the battlefield tapped unless you control two or fewer other lands.
{T}: Add {B} or {G}.","Blooming Marsh entra no campo de batalha virado, a menos que você controle dois ou menos outros terrenos.
{T}: Adicione {B} ou {G}."
301,Botanical Sanctum,"Botanical Sanctum enters the battlefield tapped unless you control two or fewer other lands.
{T}: Add {G} or {U}.","Santuário Botânico entra no campo de batalha virado, a menos que você controle dois ou menos outros terrenos.
{T}: Adicione {G} ou {U}."
302,Concealed Courtyard,"Concealed Courtyard enters the battlefield tapped unless you control two or fewer other lands.
{T}: Add {W} or {B}.","Pátio Oculto entra no campo de batalha virado, a menos que você controle dois ou menos outros terrenos.
{T}: Adicione {W} ou {B}."
303,Inspiring Vantage,"Inspiring Vantage enters the battlefield tapped unless you control two or fewer other lands.
{T}: Add {R} or {W}.","Inspiring Vantage entra no campo de batalha virado, a menos que você controle dois ou menos outros terrenos.
{T}: Adicione {R} ou {W}."
304,Spirebluff Canal,"Spirebluff Canal enters the battlefield tapped unless you control two or fewer other lands.
{T}: Add {U} or {R}.","Spirebluff Canal entra no campo de batalha virado, a menos que você controle dois ou menos outros terrenos.
{T}: Adicione {U} ou {R}."
305,"Oko, the Ringleader","At the beginning of combat on your turn, Oko, the Ringleader becomes a copy of up to one target creature you control until end of turn, except he has hexproof.
+1: Draw two cards. If you've committed a crime this turn, discard a card. Otherwise, discard two cards.
−1: Create a 3/3 green Elk creature token.
−5: For each other nonland permanent you control, create a token that's a copy of that permanent.","No início do combate no seu turno, Oko, o Líder, torna-se uma cópia de até uma criatura alvo que você controla até o final do turno, exceto por ter resistência à magia.
+1: Compre duas cartas. Se você cometeu um crime neste turno, descarte uma carta. Caso contrário, descarte duas cartas.
−1: Crie uma ficha de criatura verde 3/3 do tipo Alce.
−5: Para cada outra permanente que você controla que não seja um terreno, crie uma ficha que seja uma cópia daquela permanente."
306,Jace Reawakened,"You can't cast this spell during your first, second, or third turns of the game.
+1: Draw a card, then discard a card.
+1: You may exile a nonland card with mana value 3 or less from your hand. If you do, it becomes plotted.
−6: Until end of turn, whenever you cast a spell, copy it. You may choose new targets for the copy.","Você não pode lançar esta magia durante o primeiro, segundo ou terceiro turno do jogo.
+1: Compre uma carta e depois descarte uma carta.
+1: Você pode exilar de sua mão um card que não seja um terreno com valor de mana igual ou inferior a 3. Se você fizer isso, isso será planejado.
−6: Até o final do turno, sempre que você conjurar uma mágica, copie-a. Você pode escolher novos alvos para a cópia."
307,Another Round,"Exile any number of creatures you control, then return them to the battlefield under their owner's control. Then repeat this process X more times.","Exile qualquer número de criaturas que você controla e depois devolva-as ao campo de batalha sob o controle de seu dono. Em seguida, repita esse processo mais X vezes."
308,Archangel of Tithes,"Flying
As long as Archangel of Tithes is untapped, creatures can't attack you or planeswalkers you control unless their controller pays {1} for each of those creatures.
As long as Archangel of Tithes is attacking, creatures can't block unless their controller pays {1} for each of those creatures.","Vôo
Enquanto Archangel of Tithes estiver desvirado, as criaturas não poderão atacar você ou os planeswalkers que você controla, a menos que o controlador delas pague {1} para cada uma dessas criaturas.
Enquanto Arcanjo dos Dízimos estiver atacando, as criaturas não poderão bloquear, a menos que seu controlador pague {1} para cada uma dessas criaturas."
309,Aven Interrupter,"Flash
Flying
When Aven Interrupter enters the battlefield, exile target spell. It becomes plotted. (Its owner may cast it as a sorcery on a later turn without paying its mana cost.)
Spells your opponents cast from graveyards or from exile cost {2} more to cast.","Clarão
Vôo
Quando Interruptor Aviano entrar no campo de batalha, exile a mágica alvo. Torna-se planejado. (Seu dono pode lançá-lo como um feitiço em um turno posterior sem pagar seu custo de mana.)
As mágicas que seus oponentes conjuram dos cemitérios ou do exílio custam {2} a mais para serem conjuradas."
310,Claim Jumper,"Vigilance
When Claim Jumper enters the battlefield, if an opponent controls more lands than you, you may search your library for a Plains card and put it onto the battlefield tapped. Then if an opponent controls more lands than you, repeat this process once. If you search your library this way, shuffle.","Vigilância
Quando Claim Jumper entra no campo de batalha, se um oponente controlar mais terrenos que você, você poderá procurar em seu grimório por um card de Planície e colocá-lo no campo de batalha virado. Então, se um oponente controlar mais terrenos que você, repita esse processo uma vez. Se você pesquisar em seu grimório dessa maneira, embaralhe."
311,Dust Animus,"Flying
If you control five or more untapped lands, Dust Animus enters the battlefield with two +1/+1 counters and a lifelink counter on it.
Plot {1}{W} (You may pay {1}{W} and exile this card from your hand. Cast it as a sorcery on a later turn without paying its mana cost. Plot only as a sorcery.)","Vôo
Se você controlar cinco ou mais terrenos desvirados, Dust Animus entra no campo de batalha com dois marcadores +1/+1 e um marcador de vínculo com a vida.
Traçar {1}{W} (Você pode pagar {1}{W} e exilar este card de sua mão. Conjure-o como um feitiço em um turno posterior sem pagar seu custo de mana. Trate apenas como um feitiço.)"
312,Final Showdown,"Spree (Choose one or more additional costs.)
+ {1} — All creatures lose all abilities until end of turn.
+ {1} — Choose a creature you control. It gains indestructible until end of turn.
+ {3}{W}{W} — Destroy all creatures.","Spree (Escolha um ou mais custos adicionais.)
+ {1} — Todas as criaturas perdem todas as habilidades até o final do turno.
+ {1} — Escolha uma criatura que você controla. Ele ganha indestrutível até o final do turno.
+ {3}{W}{W} — Destrua todas as criaturas."
313,"Fortune, Loyal Steed","When Fortune, Loyal Steed enters the battlefield, scry 2.
Whenever Fortune attacks while saddled, at end of combat, exile it and up to one creature that saddled it this turn, then return those cards to the battlefield under their owner's control.
Saddle 1","Quando Fortuna, Corcel Leal, entrar no campo de batalha, use vidência 2.
Toda vez que Fortuna atacar enquanto estiver selado, no final do combate, exile-o e até uma criatura que o selou neste turno e, em seguida, devolva esses cards ao campo de batalha sob o controle de seu dono.
Sela 1"
314,High Noon,"Each player can't cast more than one spell each turn.
{4}{R}, Sacrifice High Noon: It deals 5 damage to any target.","Cada jogador não pode lançar mais de um feitiço por turno.
{4}{R}, Sacrifique Meio-dia: Causa 5 pontos de dano a qualquer alvo."
315,One Last Job,"Spree (Choose one or more additional costs.)
+ {2} — Return target creature card from your graveyard to the battlefield.
+ {1} — Return target Mount or Vehicle card from your graveyard to the battlefield.
+ {1} — Return target Aura or Equipment card from your graveyard to the battlefield attached to a creature you control.","Spree (Escolha um ou mais custos adicionais.)
+ {2} — Devolva o card de criatura alvo de seu cemitério para o campo de batalha.
+ {1} — Devolva o card alvo de Montaria ou Veículo de seu cemitério para o campo de batalha.
+ {1} — Devolva o card de Aura ou Equipamento alvo de seu cemitério para o campo de batalha anexado a uma criatura que você controla."
316,Archmage's Newt,"Whenever Archmage's Newt deals combat damage to a player, target instant or sorcery card in your graveyard gains flashback until end of turn. The flashback cost is equal to its mana cost. That card gains flashback {0} until end of turn instead if Archmage's Newt is saddled. (You may cast that card from your graveyard for its flashback cost. Then exile it.)
Saddle 3","Toda vez que Newt do Arquimago causar dano de combate a um jogador, o card de mágica instantânea ou feitiço alvo em seu cemitério ganha flashback até o final do turno. O custo do flashback é igual ao seu custo de mana. Em vez disso, aquele card ganha flashback {0} até o final do turno se Newt do Arquimago estiver selado. (Você pode conjurar aquele card de seu cemitério pagando seu custo de flashback. Depois exile-o.)
Sela 3"
317,Double Down,"Whenever you cast an outlaw spell, copy that spell. (Assassins, Mercenaries, Pirates, Rogues, and Warlocks are outlaws. Copies of permanent spells become tokens.)","Sempre que você conjurar uma mágica de fora da lei, copie essa mágica. (Assassinos, Mercenários, Piratas, Ladinos e Bruxos são fora-da-lei. Cópias de feitiços permanentes tornam-se fichas.)"
318,Duelist of the Mind,"Flying, vigilance
Duelist of the Mind's power is equal to the number of cards you've drawn this turn.
Whenever you commit a crime, you may draw a card. If you do, discard a card. This ability triggers only once each turn.","Voando, vigilância
O poder do Duelista da Mente é igual ao número de cartas que você comprou neste turno.
Sempre que você cometer um crime, você pode comprar uma carta. Se fizer isso, descarte uma carta. Esta habilidade é desencadeada apenas uma vez por turno."
319,"Fblthp, Lost on the Range","Ward {2}
You may look at the top card of your library any time.
The top card of your library has plot. The plot cost is equal to its mana cost.
You may plot nonland cards from the top of your library.","Ala {2}
Você pode olhar o card do topo do seu grimório a qualquer momento.
A carta do topo do seu grimório tem enredo. O custo do enredo é igual ao seu custo de mana.
Você pode plotar cards que não sejam terrenos do topo de seu grimório."
320,The Key to the Vault,"Whenever equipped creature deals combat damage to a player, look at that many cards from the top of your library. You may exile a nonland card from among them. Put the rest on the bottom of your library in a random order. You may cast the exiled card without paying its mana cost.
Equip {2}{U}","Toda vez que a criatura equipada causar dano de combate a um jogador, olhe aquela quantidade de cards do topo de seu grimório. Você pode exilar um card que não seja um terreno dentre eles. Coloque o restante no fundo do seu grimório em ordem aleatória. Você pode conjurar o card exilado sem pagar seu custo de mana.
Equipar {2}{U}"
321,Step Between Worlds,"Each player may shuffle their hand and graveyard into their library. Each player who does draws seven cards. Exile Step Between Worlds.
Plot {4}{U}{U} (You may pay {4}{U}{U} and exile this card from your hand. Cast it as a sorcery on a later turn without paying its mana cost. Plot only as a sorcery.)","Cada jogador pode embaralhar sua mão e seu cemitério em seu grimório. Cada jogador que fizer isso compra sete cartas. Passo do exílio entre mundos.
Plotar {4}{U}{U} (Você pode pagar {4}{U}{U} e exilar este card de sua mão. Lance-o como um feitiço em um turno posterior sem pagar seu custo de mana. Plote apenas como um feitiço feitiçaria.)"
