numero,nome,texto_ingles,traduzido
131,Powerbalance,"Whenever an opponent casts a spell, you may reveal the top card of your library. If you do, you may cast that card without paying its mana cost if the two spells have the same mana value.","Sempre que um oponente conjurar uma mágica, você poderá revelar o card do topo do seu grimório. Se fizer isso, você poderá conjurar aquele card sem pagar seu custo de mana se as duas mágicas tiverem o mesmo valor de mana."
138,"Skoa, Embermage","When Skoa, Embermage enters the battlefield, deals 4 damage to any target.
Grandeur — Discard another card named Skoa, Embermage, Sacrifice two Mountains: Skoa deals 4 damage to any target.","Quando Skoa, Embermage, entra no campo de batalha, causa 4 pontos de dano a qualquer alvo.<br>Grandeza – Descarte outra carta chamada Skoa, Embermage, sacrifique duas montanhas: Skoa causa 4 pontos de dano a qualquer alvo."
140,Spawn-Gang Commander,"Devoid (This card has no color.)
When you cast this spell, create three 0/1 colorless Eldrazi Spawn creature tokens with ""Sacrifice this creature: Add {C}.""
{1}{C}, Sacrifice an Eldrazi: Spawn-Gang Commander deals 2 damage to any target.","Desprovido (Este card não tem cor.)<br>Quando você conjurar esta mágica, crie três fichas de criatura incolor 0/1 do tipo Prole Eldrazi com ""Sacrifique esta criatura: Adicione {C}.""<br>{1}{C}, sacrifique um Eldrazi: Spawn-Gang Commander causa 2 pontos de dano a qualquer alvo."
144,Wheel of Potential,"You get {E}{E}{E} (three energy counters), then you may pay X {E}.
Each player may exile their hand and draw X cards. If X is 7 or more, you may play cards you own exiled this way until the end of your next turn.","Você recebe {E}{E}{E} (três marcadores de energia) e pode pagar X {E}.<br>Cada jogador pode exilar sua mão e comprar X cartas. Se X for 7 ou mais, você poderá jogar cartas que você possui exiladas desta forma até o final do seu próximo turno."
145,Basking Broodscale,"Devoid (This card has no color.)
{1}{G}: Adapt 1. (If this creature has no +1/+1 counters on it, put a +1/+1 counter on it.)
Whenever one or more +1/+1 counters are put on Basking Broodscale, you may create a 0/1 colorless Eldrazi Spawn creature token with ""Sacrifice this creature: Add {C}.""","Desprovido (Este card não tem cor.)<br>{1}{G}: Adaptação 1. (Se esta criatura não tiver marcadores +1/+1, coloque um marcador +1/+1 nela.)<br>Toda vez que um ou mais marcadores +1/+1 forem colocados em Basking Broodscale, você pode criar uma ficha de criatura incolor 0/1 do tipo Prole Eldrazi com ""Sacrifique esta criatura: Adicione {C}."""
147,Collective Resistance,"Escalate {G} (Pay this cost for each mode chosen beyond the first.)
Choose one or more —
• Destroy target artifact.
• Destroy target enchantment.
• Target creature gains hexproof and indestructible until end of turn.",Escalar {G} (Pague este custo para cada modo escolhido além do primeiro.)<br>Escolha um ou mais -<br>• Destrua o artefato alvo.<br>• Destrua o encantamento do alvo.<br>• A criatura alvo ganha resistência à magia e indestrutível até o final do turno.
149,"Eladamri, Korvecdal","You may look at the top card of your library any time.
You may cast creature spells from the top of your library.
{G}, {T}, Tap two untapped creatures you control: Reveal a card from your hand or the top card of your library. If you reveal a creature card this way, put it onto the battlefield. Activate only during your turn.","Você pode olhar o card do topo do seu grimório a qualquer momento.<br>Você pode conjurar mágicas de criatura do topo de seu grimório.<br>{G}, {T}, Vire duas criaturas desviradas que você controla: Revele um card de sua mão ou o card do topo de seu grimório. Se você revelar um card de criatura desta forma, coloque-o no campo de batalha. Ative apenas durante o seu turno."
151,Evolution Witness,"{1}{G}: Adapt 2. (If this creature has no +1/+1 counters on it, put two +1/+1 counters on it.)
Whenever one or more +1/+1 counters are put on Evolution Witness, return target permanent card from your graveyard to your hand.","{1}{G}: Adaptação 2. (Se esta criatura não tiver marcadores +1/+1, coloque dois marcadores +1/+1 nela.)<br>Toda vez que um ou mais marcadores +1/+1 forem colocados em Evolution Witness, devolva o card permanente alvo de seu cemitério para sua mão."
154,Flare of Cultivation,"You may sacrifice a nontoken green creature rather than pay this spell's mana cost.
Search your library for up to two basic land cards, reveal those cards, put one onto the battlefield tapped and the other into your hand, then shuffle.","Você pode sacrificar uma criatura verde que não seja uma ficha em vez de pagar o custo de mana desta mágica.<br>Procure em seu grimório por até dois cards de terreno básico, revele esses cards, coloque um no campo de batalha virado e o outro em sua mão e depois embaralhe."
165,Path of Annihilation,"Devoid (This card has no color.)
When Path of Annihilation enters the battlefield, create two 0/1 colorless Eldrazi Spawn creature tokens with ""Sacrifice this creature: Add {C}.""
Eldrazi you control have ""{T}: Add one mana of any color.""
Whenever you cast a creature spell with mana value 7 or greater, you gain 4 life.","Desprovido (Este card não tem cor.)<br>Quando Caminho da Aniquilação entrar no campo de batalha, crie duas fichas de criatura incolor 0/1 do tipo Prole Eldrazi com ""Sacrifique esta criatura: Adicione {C}.""<br>Os Eldrazi que você controla têm ""{T}: Adicione um mana de qualquer cor.""<br>Sempre que você conjurar uma mágica de criatura com valor de mana igual ou superior a 7, você ganha 4 pontos de vida."
169,Six,"Reach
Whenever Six attacks, mill three cards. You may put a land card from among them into your hand.
As long as it's your turn, nonland permanent cards in your graveyard have retrace. (You may cast permanent cards from your graveyard by discarding a land card in addition to paying their other costs.)","Alcançar<br>Sempre que Seis atacar, moa três cartas. Você pode colocar um card de terreno dentre eles em sua mão.<br>Enquanto for o seu turno, os cards permanentes que não sejam terrenos em seu cemitério poderão ser retraçados. (Você pode conjurar cards permanentes de seu cemitério descartando um card de terreno além de pagar seus outros custos.)"
174,Thief of Existence,"Devoid (This card has no color.)
When you cast this spell, exile up to one target noncreature, nonland permanent an opponent controls with mana value 4 or less. If you do, Thief of Existence gains ""When this creature leaves the battlefield, target opponent draws a card.""","Desprovido (Este card não tem cor.)<br>Quando você conjurar esta mágica, exile até uma permanente alvo que não seja uma criatura e que não seja um terreno que um oponente controla com valor de mana igual ou inferior a 4. Se fizer isso, Ladrão da Existência ganha “Quando esta criatura sai do campo de batalha, o oponente alvo compra um card”."
175,Trickster's Elk,"Bestow {1}{G} (If you cast this card for its bestow cost, it's an Aura spell with enchant creature. It becomes a creature again if it's not attached.)
Enchanted creature loses all abilities and is a green Elk creature with base power and toughness 3/3.","Agraciar {1}{G} (Se você conjurar este card pagando seu custo de agraciar, ele será uma mágica de Aura com encantar criatura. Ele se tornará uma criatura novamente se não for anexado.)<br>A criatura encantada perde todas as habilidades e é uma criatura Alce verde com poder básico e resistência 3/3."
176,Wumpus Aberration,"Devoid (This card has no color.)
When you cast this spell, if {C} wasn't spent to cast it, target opponent may put a creature card from their hand onto the battlefield.
Trample","Desprovido (Este card não tem cor.)<br>Quando você conjurar esta mágica, se {C} não tiver sido gasto para conjurá-la, o oponente alvo poderá colocar um card de criatura de sua mão no campo de batalha.<br>Atropelar"
178,"Arna Kennerüd, Skycaptain","Flying, lifelink
Ward—Discard a card.
Whenever a modified creature you control attacks, double the number of each kind of counter on it. Then for each nontoken permanent attached to it, create a token that's a copy of that permanent attached to that creature.","Voar, vínculo vitalício<br>Ward – Descarte uma carta.<br>Toda vez que uma criatura modificada que você controla atacar, dobre o número de cada tipo de marcador nela. Então, para cada permanente que não seja uma ficha anexada a ela, crie uma ficha que seja uma cópia daquela permanente anexada àquela criatura."
179,Conduit Goblin,"When Conduit Goblin enters the battlefield, you get {E}{E} (two energy counters).
At the beginning of combat on your turn, you may pay {E}. If you do, another target creature you control gets +1/+0 and gains haste until end of turn.","Quando Goblin Conduíte entra no campo de batalha, você recebe {E}{E} (dois marcadores de energia).<br>No início do combate no seu turno, você pode pagar {E}. Se fizer isso, outra criatura alvo que você controla recebe +1/+0 e ganha impeto até o final do turno."
186,"Genku, Future Shaper","Whenever another nontoken permanent you control leaves the battlefield, choose one that hasn't been chosen this turn. Create a creature token with those characteristics.
• 2/2 white Fox with vigilance.
• 1/2 blue Moonfolk with flying.
• 1/1 black Rat with lifelink.
{3}{W}{U}: Put a +1/+1 counter on each creature you control.","Toda vez que outra permanente que você controla que não seja uma ficha deixar o campo de batalha, escolha uma que não tenha sido escolhida neste turno. Crie uma ficha de criatura com essas características.<br>• 2/2 Raposa branca com vigilância.<br>• 1/2 Moonfolk azul com voar.<br>• 1/1 Rato preto com vínculo com a vida.<br>{3}{W}{U}: Coloque um marcador +1/+1 em cada criatura que você controla."
191,Izzet Generatorium,"If you would get one or more {E} (energy counters), you get that many plus one {E} instead.
{T}: Draw a card. Activate only if you've paid or lost four or more {E} this turn.","Se você obtivesse um ou mais {E} (contadores de energia), você obteria essa quantidade mais um {E}.<br>{T}: Compre um card. Ative apenas se você pagou ou perdeu quatro ou mais {E} neste turno."
192,"Kudo, King Among Bears",Other creatures have base power and toughness 2/2 and are Bears in addition to their other types.,Outras criaturas têm poder e resistência básicos 2/2 e são Ursos além de seus outros tipos.
194,The Necrobloom,"Landfall — Whenever a land enters the battlefield under your control, create a 0/1 green Plant creature token. If you control seven or more lands with different names, create a 2/2 black Zombie creature token instead.
Land cards in your graveyard have dredge 2. (You may return a land card from your graveyard to your hand and mill two cards instead of drawing a card.)","Landfall — Toda vez que um terreno entrar no campo de batalha sob seu controle, crie uma ficha de criatura verde 0/1 do tipo Planta. Se você controlar sete ou mais terrenos com nomes diferentes, em vez disso, crie uma ficha de criatura preta 2/2 do tipo Zumbi.<br>Os cards de terreno em seu cemitério têm dragagem 2. (Você pode devolver um card de terreno de seu cemitério para sua mão e moer dois cards em vez de comprar um card.)"
199,Psychic Frog,"Whenever Psychic Frog deals combat damage to a player or planeswalker, draw a card.
Discard a card: Put a +1/+1 counter on Psychic Frog.
Exile three cards from your graveyard: Psychic Frog gains flying until end of turn.","Toda vez que Sapo Psíquico causar dano de combate a um jogador ou planeswalker, compre um card.<br>Descarte um card: Coloque um marcador +1/+1 em Psychic Frog.<br>Exile três cards de seu cemitério: Sapo Psíquico ganha voar até o final do turno."
203,Scurry of Gremlins,"When Scurry of Gremlins enters the battlefield, create two 1/1 red Gremlin creature tokens. Then you get an amount of {E} (energy counters) equal to the number of creatures you control.
Pay {E}{E}{E}{E}: Creatures you control get +1/+0 and gain haste until end of turn.","Quando Scurry of Gremlins entrar no campo de batalha, crie duas fichas de criatura vermelhas 1/1 do tipo Gremlin. Então você recebe uma quantidade de {E} (contadores de energia) igual ao número de criaturas que você controla.<br>Pague {E}{E}{E}{E}: As criaturas que você controla recebem +1/+0 e ganham ímpeto até o final do turno."
207,Wight of the Reliquary,"Vigilance
Wight of the Reliquary gets +1/+1 for each creature card in your graveyard.
{T}, Sacrifice another creature: Search your library for a land card, put it onto the battlefield tapped, then shuffle.","Vigilância<br>Wight of the Relicary recebe +1/+1 para cada card de criatura em seu cemitério.<br>{T}, Sacrifique outra criatura: Procure um card de terreno em seu grimório, coloque-o no campo de batalha virado e depois embaralhe."
208,Writhing Chrysalis,"Devoid (This card has no color.)
When you cast this spell, create two 0/1 colorless Eldrazi Spawn creature tokens with ""Sacrifice this creature: Add {C}.""
Reach
Whenever you sacrifice another Eldrazi, put a +1/+1 counter on Writhing Chrysalis.","Desprovido (Este card não tem cor.)<br>Quando você conjurar esta mágica, crie duas fichas de criatura incolor 0/1 do tipo Prole Eldrazi com ""Sacrifique esta criatura: Adicione {C}.""<br>Alcançar<br>Sempre que você sacrificar outro Eldrazi, coloque um marcador +1/+1 em Crisálida Contorcida."
213,Winter Moon,Players can't untap more than one nonbasic land during their untap steps.,Os jogadores não podem desvirar mais de um terreno não básico durante suas etapas de desvirar.
216,Bloodstained Mire,"{T}, Pay 1 life, Sacrifice Bloodstained Mire: Search your library for a Swamp or Mountain card, put it onto the battlefield, then shuffle.","{T}, Pague 1 ponto de vida, Sacrifique Pântano Manchado de Sangue: Procure um card de Pântano ou Montanha em seu grimório, coloque-o no campo de batalha e depois embaralhe."
220,Flooded Strand,"{T}, Pay 1 life, Sacrifice Flooded Strand: Search your library for a Plains or Island card, put it onto the battlefield, then shuffle.","{T}, pague 1 ponto de vida, sacrifique Praia Inundada: Procure um card de Planície ou Ilha em seu grimório, coloque-o no campo de batalha e depois embaralhe."
224,Polluted Delta,"{T}, Pay 1 life, Sacrifice Polluted Delta: Search your library for an Island or Swamp card, put it onto the battlefield, then shuffle.","{T}, pague 1 ponto de vida, sacrifique Polluted Delta: Procure em seu grimório por um card de Ilha ou Pântano, coloque-o no campo de batalha e depois embaralhe."
229,Snow-Covered Wastes,{T}: Add {C}.,{T}: Adicione {C}.
230,Spymaster's Vault,"Spymaster's Vault enters the battlefield tapped unless you control a Swamp.
{T}: Add {B}.
{B}, {T}: Target creature you control connives X, where X is the number of creatures that died this turn. (Draw X cards, then discard X cards. Put a +1/+1 counter on that creature for each nonland card discarded this way.)","Cofre do Spymaster entra no campo de batalha virado, a menos que você controle um Pântano.<br>{T}: Adicione {B}.<br>{B}, {T}: A criatura alvo que você controla é conivente com X, onde X é o número de criaturas que morreram neste turno. (Compre X cards e depois descarte X cards. Coloque um marcador +1/+1 naquela criatura para cada card que não seja um terreno descartado dessa forma.)"
233,Ugin's Labyrinth,"Imprint — When Ugin's Labyrinth enters the battlefield, you may exile a colorless card with mana value 7 or greater from your hand.
{T}: Add {C}. If a card is exiled with Ugin's Labyrinth, add {C}{C} instead.
{T}: Return the exiled card to its owner's hand.","Estampar — Quando Labirinto de Ugin entra no campo de batalha, você pode exilar um card incolor com valor de mana igual ou superior a 7 de sua mão.<br>{T}: Adicione {C}. Se um card for exilado com o Labirinto de Ugin, adicione {C}{C} em vez disso.<br>{T}: Devolva o card exilado para a mão de seu dono."
234,Urza's Cave,"{T}: Add {C}.
{3}, {T}, Sacrifice Urza's Cave: Search your library for a land card, put it onto the battlefield tapped, then shuffle.","{T}: Adicione {C}.<br>{3}, {T}, Sacrifique Caverna de Urza: Procure um card de terreno em seu grimório, coloque-o no campo de batalha virado e depois embaralhe."
235,Windswept Heath,"{T}, Pay 1 life, Sacrifice Windswept Heath: Search your library for a Forest or Plains card, put it onto the battlefield, then shuffle.","{T}, pague 1 ponto de vida, sacrifique Windswept Heath: Procure em seu grimório por um card de Floresta ou Planície, coloque-o no campo de batalha e depois embaralhe."
236,Wooded Foothills,"{T}, Pay 1 life, Sacrifice Wooded Foothills: Search your library for a Mountain or Forest card, put it onto the battlefield, then shuffle.","{T}, pague 1 ponto de vida, sacrifique Contrafortes Arborizados: Procure um card de Montanha ou Floresta em seu grimório, coloque-o no campo de batalha e depois embaralhe."
237,"Ajani, Nacatl Pariah // Ajani, Nacatl Avenger","When Ajani, Nacatl Pariah enters the battlefield, create a 2/1 white Cat Warrior creature token.
Whenever one or more other Cats you control die, you may exile Ajani, then return him to the battlefield transformed under his owner's control.
----
+2: Put a +1/+1 counter on each Cat you control.
0: Create a 2/1 white Cat Warrior creature token. When you do, if you control a red permanent other than Ajani, Nacatl Avenger, he deals damage equal to the number of creatures you control to any target.
−4: Each opponent chooses an artifact, a creature, an enchantment and a planeswalker from among the nonland permanents they control, then sacrifices the rest.","Quando Ajani, Nacatl Pariah, entrar no campo de batalha, crie uma ficha de criatura branca 2/1 do tipo Gato Guerreiro.<br>Sempre que um ou mais Gatos que você controla morrem, você pode exilar Ajani e depois devolvê-lo ao campo de batalha transformado sob o controle de seu dono.<br>----<br>+2: Coloque um marcador +1/+1 em cada Gato que você controla.<br>0: Crie uma ficha de criatura branca 2/1 do tipo Gato Guerreiro. Ao fazer isso, se você controlar uma permanente vermelha que não seja Ajani, Nacatl Avenger, ela causará dano igual ao número de criaturas que você controla a qualquer alvo.<br>−4: Cada oponente escolhe um artefato, uma criatura, um encantamento e um planeswalker dentre as permanentes que não sejam terrenos que ele controla e depois sacrifica o resto."
239,Witch Enchanter // Witch-Blessed Meadow,"When Witch Enchanter enters the battlefield, destroy target artifact or enchantment an opponent controls.
----
As Witch-Blessed Meadow enters the battlefield, you may pay 3 life. If you don't, it enters the battlefield tapped.
{T}: Add {W}.","Quando Witch Enchanter entrar no campo de batalha, destrua o artefato ou encantamento alvo que um oponente controla.<br>----<br>Conforme Prado Abençoado pela Bruxa entra no campo de batalha, você pode pagar 3 pontos de vida. Caso contrário, ele entra no campo de batalha virado.<br>{T}: Adicione {W}."
242,"Tamiyo, Inquisitive Student // Tamiyo, Seasoned Scholar","Flying
Whenever Tamiyo, Inquisitive Student attacks, investigate. (Create a Clue token. It's an artifact with ""{2}, Sacrifice this artifact: Draw a card."")
When you draw your third card in a turn, exile Tamiyo, then return her to the battlefield transformed under her owner's control.
----
+2: Until your next turn, whenever a creature attacks you or a planeswalker you control, it gets -1/-0 until end of turn.
−3: Return target instant or sorcery card from your graveyard to your hand. If it's a green card, add one mana of any color.
−7: Draw cards equal to half the number of cards in your library, rounded up. You get an emblem with ""You have no maximum hand size.""","Voar<br>Sempre que Tamiyo, Estudante Inquisitivo, atacar, investigue. (Crie uma ficha de Pista. É um artefato com ""{2}, Sacrifique este artefato: Compre um card."")<br>Quando você comprar sua terceira carta em um turno, exile Tamiyo e depois devolva-a ao campo de batalha transformada sob o controle de seu dono.<br>----<br>+2: Até seu próximo turno, sempre que uma criatura atacar você ou um planeswalker que você controla, ela receberá -1/-0 até o final do turno.<br>−3: Devolva o card de mágica instantânea ou feitiço alvo de seu cemitério para sua mão. Se for um green card, adicione um mana de qualquer cor.<br>−7: Compre cards iguais à metade do número de cards em seu grimório, arredondado para cima. Você recebe um emblema com ""Você não tem tamanho máximo de mão""."
245,"Sorin of House Markov // Sorin, Ravenous Neonate","Lifelink
Extort (Whenever you cast a spell, you may pay {W/B}. If you do, each opponent loses 1 life and you gain that much life.)
At the beginning of your postcombat main phase, if you gained 3 or more life this turn, exile Sorin of House Markov, then him to the battlefield transformed under his owner's control.
----
Extort (Whenever you cast a spell, you may pay {W/B}. If you do, each opponent loses 1 life and you gain that much life.)
+2: Create a Food token.
−1: Sorin, Ravenous Neonate deals damage equal to the amount of life you gained this turn to any target.
−6: Gain control of target creature. It becomes a Vampire in addition to its other types. Put a lifelink counter on it if you control a white permanent other than that creature or Sorin.","Vínculo com a vida<br>Extorquir (Sempre que você conjurar uma mágica, você pode pagar {W/B}. Se isso acontecer, cada oponente perde 1 ponto de vida e você ganha essa mesma quantidade de pontos de vida.)<br>No início de sua fase principal pós-combate, se você ganhou 3 ou mais pontos de vida neste turno, exile Sorin da Casa Markov e, em seguida, ele para o campo de batalha transformado sob o controle de seu dono.<br>----<br>Extorquir (Sempre que você conjurar uma mágica, você pode pagar {W/B}. Se isso acontecer, cada oponente perde 1 ponto de vida e você ganha essa mesma quantidade de pontos de vida.)<br>+2: Crie uma ficha de Comida.<br>−1: Sorin, Ravenous Neonate, causa dano igual à quantidade de pontos de vida que você ganhou neste turno a qualquer alvo.<br>−6: Ganhe o controle da criatura alvo. Torna-se um Vampiro além de seus outros tipos. Coloque nela um marcador de vínculo com a vida se você controlar uma permanente branca que não seja aquela criatura ou Sorin."
247,"Ral, Monsoon Mage // Ral, Leyline Prodigy","Instant and sorcery spells you cast cost {1} less to cast.
Whenever you cast an instant or sorcery spell during your turn, flip a coin. If you lose the flip, Ral, Monsoon Mage deals 1 damage to you. If you win the flip, you may exile Ral. If you do, return him to the battlefield transformed under his owner's control.
----
Ral, Leyline Prodigy enters the battlefield with an additional loyalty counter on him for each instant and sorcery spell you've cast this turn.
+1: Until your next turn, instant and sorcery spells you cast cost {1} less to cast.
−2: Ral deals 2 damage divided as you choose among one or two targets. Draw a card if you control a blue permanent other than Ral.
−8: Exile the top eight cards of your library. You may cast instant and sorcery spells from among them this turn without paying their mana costs.","As mágicas instantâneas e os feitiços que você conjura custam {1} a menos para conjurar.<br>Sempre que você conjurar uma mágica instantânea ou feitiço durante seu turno, jogue uma moeda. Se você perder o turno, Ral, Monsoon Mage, causará 1 de dano a você. Se você vencer, poderá exilar Ral. Se fizer isso, devolva-o ao campo de batalha transformado sob o controle de seu dono.<br>----<br>Ral, Prodígio da Linha de Ley, entra no campo de batalha com um marcador de lealdade adicional para cada mágica instantânea e feitiço que você conjurou neste turno.<br>+1: Até seu próximo turno, os feitiços instantâneos e os feitiços que você conjurar custam {1} a menos para serem conjurados.<br>−2: Ral causa 2 pontos de dano divididos conforme você escolher entre um ou dois alvos. Compre um card se você controlar uma permanente azul que não seja Ral.<br>−8: Exile os oito cards do topo do seu grimório. Você pode conjurar mágicas instantâneas e feitiços dentre eles neste turno sem pagar seus custos de mana."
250,Disciple of Freyalise // Garden of Freyalise,"When Disciple of Freyalise enters the battlefield, you may sacrifice another creature. If you do, you gain X life and draw X cards, where X is that creature's power.
----
As Garden of Freyalise enters the battlefield, you may pay 3 life. If you don't, it enters the battlefield tapped.
{T}: Add {G}.","Quando Discípulo de Freyalise entra no campo de batalha, você pode sacrificar outra criatura. Se fizer isso, você ganha X pontos de vida e compra X cards, sendo X o poder daquela criatura.<br>----<br>Conforme Garden of Freyalise entra no campo de batalha, você pode pagar 3 pontos de vida. Caso contrário, ele entra no campo de batalha virado.<br>{T}: Adicione {G}."
