numero,nome,texto_ingles,traduzido
251,"Grist, Voracious Larva // Grist, the Plague Swarm","Deathtouch
Whenever Grist, Voracious Larva or another creature enters the battlefield under your control, if it entered from your graveyard or you cast it from your graveyard, you may pay {G}. If you do, exile Grist, then return it to the battlefield transformed under its owner's control.
----
+1: Create a 1/1 black and green Insect creature token, then mill two cards. Put a deathtouch counter on the token if a black card was milled this way.
−2: Destroy target artifact or enchantment.
−6: For each creature card in your graveyard, create a token that's a copy of it, except it's a 1/1 black and green Insect.","Toque da morte<br>Toda vez que Grist, Voracious Larva ou outra criatura entrar no campo de batalha sob seu controle, se ela entrou de seu cemitério ou se você a conjurar de seu cemitério, você poderá pagar {G}. Se fizer isso, exile Grist e devolva-o ao campo de batalha transformado sob o controle de seu dono.<br>----<br>+1: Crie uma ficha de criatura preta e verde 1/1 do tipo Inseto e, em seguida, moa dois cards. Coloque um marcador de toque mortífero na ficha se uma carta preta tiver sido moída dessa maneira.<br>−2: Destrua o artefato ou encantamento alvo.<br>−6: Para cada card de criatura em seu cemitério, crie uma ficha que seja uma cópia dele, exceto que é um Inseto preto e verde 1/1."
252,Bloodsoaked Insight // Sanguine Morass,"This spell costs 1 less to cast for each 1 life your opponents have lost this turn.
Target opponent exiles the top three cards of their library. Until the end of your next turn, you may play those cards. If you cast a spell this way, mana of any type can be spent to cast it.
----
Sanguine Morass enters the battlefield tapped.
{T}: Add {B} or {R}.","Este feitiço custa 1 a menos para ser conjurado para cada 1 ponto de vida que seus oponentes perderam neste turno.<br>O oponente alvo exila os três cards do topo do seu grimório. Até o final do seu próximo turno, você pode jogar essas cartas. Se você conjurar uma mágica dessa maneira, qualquer tipo de mana poderá ser gasto para conjurá-la.<br>----<br>Lamaçal Sanguíneo entra no campo de batalha virado.<br>{T}: Adicione {B} ou {R}."
253,Drowner of Truth // Drowned Jungle,"Devoid (This card has no color.)
When you cast this spell, if {C} was spent to cast it, create two 0/1 colorless Eldrazi Spawn creature tokens with ""Sacrifice this creature: Add {C}.""
----
Drowned Jungle enters the battlefield tapped.
{T}: Add {G} or {U}.","Desprovido (Este card não tem cor.)<br>Quando você conjurar esta mágica, se {C} foi gasto para conjurá-la, crie duas fichas de criatura incolor 0/1 do tipo Prole Eldrazi com ""Sacrifique esta criatura: Adicione {C}.""<br>----<br>Selva Afogada entra no campo de batalha virado.<br>{T}: Adicione {G} ou {U}."
254,Glasswing Grace // Age-Graced Chapel,"Enchant creature
Enchanted creature gets +2/+2 and has flying and lifelink.
----
Age-Graced Chapel enters the battlefield tapped.
{T}: Add or {W} or {B}.",Encantar criatura<br>A criatura encantada recebe +2/+2 e tem voar e vínculo com a vida.<br>----<br>Capela Agraciada pela Idade entra no campo de batalha virada.<br>{T}: Adicione ou {W} ou {B}.
255,Legion Leadership // Legion Stronghold,"Until end of turn, double target creature's power and it gains first strike.
----
Legion Stronghold enters the battlefield tapped.
{T}: Add {R} or {W}.","Até o final do turno, dobre o poder da criatura alvo e ela ganha iniciativa.<br>----<br>Fortaleza da Legião entra no campo de batalha virada.<br>{T}: Adicione {R} ou {W}."
256,Revitalizing Repast // Old-Growth Grove,"Put a +1/+1 counter on target creature. It gains indestructible until end of turn.
----
Old-Growth Grove enters the battlefield tapped.
{T}: Add {B} or {G}.",Coloque um marcador +1/+1 na criatura alvo. Ele ganha indestrutível até o final do turno.<br>----<br>Bosque Antigo entra no campo de batalha virado.<br>{T}: Adicione {B} ou {G}.
257,Rush of Inspiration // Crackling Falls,"Draw two cards. Then discard a card at random unless you pay {E}{E} (two energy counters).
----
Crackling Falls enters the battlefield tapped.
{T}: Add {U} or {R}.","Compre duas cartas. Em seguida, descarte uma carta aleatoriamente, a menos que você pague {E}{E} (dois marcadores de energia).<br>----<br>Crackling Falls entra no campo de batalha virado.<br>{T}: Adicione {U} ou {R}."
258,Strength of the Harvest // Haven of the Harvest,"Enchant creature
Enchanted creature gets +1/+1 for each creature and/or enchantment you control.
----
Haven of the Harvest enters the battlefield tapped.
{T}: {G} or {W}.",Encantar criatura<br>A criatura encantada recebe +1/+1 para cada criatura e/ou encantamento que você controla.<br>----<br>Haven of the Harvest entra no campo de batalha virado.<br>{T}: {G} ou {W}.
259,Stump Stomp // Burnwillow Clearing,"Target creature you control deals damage equal to its power to target creature or planeswalker you don't control.
----
Burnwillow Clearing enters the battlefield tapped.
{T}: Add {R} or {G}.",A criatura alvo que você controla causa dano igual ao seu poder à criatura ou planeswalker alvo que você não controla.<br>----<br>Clareira Burnwillow entra no campo de batalha virada.<br>{T}: Adicione {R} ou {G}.
260,Suppression Ray // Orderly Plaza,"Tap all creatures target player controls. You may pay X {E}, then choose up to X creatures tapped this way. Put a stun counter on each of them. (If a permanent with a stun counter would become untapped, remove one from it instead.)
----
Orderly Plaza enters the battlefield tapped.
{T}: Add {W} or {U}.","Toque em todas as criaturas que o jogador alvo controla. Você pode pagar X {E} e depois escolher até X criaturas viradas desta forma. Coloque um contador de atordoamento em cada um deles. (Se uma permanente com um marcador de atordoamento ficar desvirada, em vez disso, remova um dela.)<br>----<br>Praça Ordenada entra no campo de batalha virada.<br>{T}: Adicione {W} ou {U}."
261,Waterlogged Teachings // Inundated Archive,"Search your library for an instant card or a card with flash, reveal it, put it into your hand, then shuffle.
----
Inundated Archive enters the battlefield tapped.
{T}: Add {U} or {B}.","Procure em seu grimório um card de mágica instantânea ou um card com flash, revele-o, coloque-o em sua mão e depois embaralhe.<br>----<br>Arquivo Inundado entra no campo de batalha virado.<br>{T}: Adicione {U} ou {B}."
265,Orim's Chant,"Kicker {W} (You may pay an additional {W} as you cast this spell.)
Target player can't cast spells this turn. If this spell was kicked, creatures can't attack this turn.","Reforçador {W} (Você pode pagar um valor adicional de {W} ao conjurar esta mágica.)<br>O jogador alvo não pode conjurar mágicas neste turno. Se esta mágica foi reforçada, as criaturas não podem atacar neste turno."
268,Deep Analysis,"Target player draws two cards.
Flashback—{1}{U}, Pay 3 life. (You may cast this card from your graveyard for its flashback cost. Then exile it.)","O jogador alvo compra duas cartas.<br>Flashback — {1}{U}, pague 3 pontos de vida. (Você pode conjurar este card de seu cemitério pagando seu custo de flashback. Depois exile-o.)"
270,Kappa Cannoneer,"Improvise (Your artifacts can help cast this spell. Each artifact you tap after you're done activating mana abilities pays for {1}.)
Ward {4}
Whenever an artifact enters the battlefield under your control, put a +1/+1 counter on Kappa Cannoneer and it can't be blocked this turn.","Improvisar (Seus artefatos podem ajudar a conjurar esta mágica. Cada artefato que você vira depois de ativar as habilidades de mana paga {1}.)<br>Ala {4}<br>Toda vez que um artefato entrar no campo de batalha sob seu controle, coloque um marcador +1/+1 em Kappa Cannoneer e ele não poderá ser bloqueado neste turno."
274,"K'rrik, Son of Yawgmoth","({B/P} can be paid with either {B} or 2 life.)
Lifelink
For each {B} in a cost, you may pay 2 life rather than pay that mana.
Whenever you cast a black spell, put a +1/+1 counter on K'rrik, Son of Yawgmoth.","({B/P} pode ser pago com {B} ou 2 pontos de vida.)<br>Vínculo com a vida<br>Para cada {B} em um custo, você pode pagar 2 pontos de vida em vez de pagar aquele mana.<br>Toda vez que você conjurar uma mágica negra, coloque um marcador +1/+1 em K'rrik, Filho de Yawgmoth."
276,Ophiomancer,"At the beginning of each upkeep, if you control no Snakes, create a 1/1 black Snake creature token with deathtouch.","No início de cada manutenção, se você não controlar nenhuma Cobra, crie uma ficha de criatura preta 1/1 do tipo Cobra com toque mortífero."
278,Victimize,"Choose two target creature cards in your graveyard. Sacrifice a creature. If you do, return the chosen cards to the battlefield tapped.","Escolha dois cards de criatura alvo em seu cemitério. Sacrifique uma criatura. Se fizer isso, devolva os cards escolhidos ao campo de batalha virados."
279,Cursed Mirror,"{T}: Add {R}.
As Cursed Mirror enters the battlefield, you may have it become a copy of any creature on the battlefield until end of turn, except it has haste.","{T}: Adicione {R}.<br>Conforme Cursed Mirror entra no campo de batalha, você pode fazer com que ele se torne uma cópia de qualquer criatura no campo de batalha até o final do turno, exceto que ele tem impeto."
281,"Laelia, the Blade Reforged","Haste
Whenever Laelia, the Blade Reforged attacks, exile the top card of your library. You may play that card this turn.
Whenever one or more cards are put into exile from your library and/or your graveyard, put a +1/+1 counter on Laelia.","Impeto<br>Sempre que Laelia, a Lâmina Reforjada, atacar, exile o card do topo do seu grimório. Você pode jogar aquela carta neste turno.<br>Toda vez que um ou mais cards forem exilados de seu grimório e/ou cemitério, coloque um marcador +1/+1 em Laelia."
282,Meltdown,Destroy each artifact with mana value X or less.,Destrua cada artefato com valor de mana X ou menos.
286,Priest of Titania,{T}: Add {G} for each Elf on the battlefield.,{T}: Adicione {G} para cada Elfo no campo de batalha.
287,Sylvan Safekeeper,Sacrifice a land: Target creature you control gains shroud until end of turn. (It can't be the target of spells or abilities.),Sacrifique um terreno: A criatura alvo que você controla ganha mortalha até o final do turno. (Não pode ser alvo de mágicas ou habilidades.)
288,Wirewood Symbiote,Return an Elf you control to its owner's hand: Untap target creature. Activate only once each turn.,Devolva um Elfo que você controla para a mão de seu dono: desvire a criatura alvo. Ative apenas uma vez em cada turno.
289,"Breya, Etherium Shaper","When Breya, Etherium Shaper enters the battlefield, create two 1/1 blue Thopter artifact creature tokens with flying.
{2}, Sacrifice two artifacts: Choose one —
• Breya deals 3 damage to target player or planeswalker.
• Target creature gets -4/-4 until end of turn.
• You gain 5 life.","Quando Breya, Moldadora de Etherium, entrar no campo de batalha, crie duas fichas de criatura artefato azuis 1/1 do tipo Tóptero com voar.<br>{2}, Sacrifique dois artefatos: Escolha um —<br>• Breya causa 3 pontos de dano ao jogador ou planeswalker alvo.<br>• A criatura alvo recebe -4/-4 até o final do turno.<br>• Você ganha 5 pontos de vida."
290,Kaalia of the Vast,"Flying
Whenever Kaalia of the Vast attacks an opponent, you may put an Angel, Demon, or Dragon creature card from your hand onto the battlefield tapped and attacking that opponent.","Voar<br>Toda vez que Kaalia of the Vast ataca um oponente, você pode colocar no campo de batalha um card de criatura Anjo, Demônio ou Dragão de sua mão virado e atacando aquele oponente."
291,Emerald Medallion,Green spells you cast cost {1} less to cast.,As mágicas verdes que você conjura custam {1} a menos para conjurar.
292,Jet Medallion,Black spells you cast cost {1} less to cast.,As mágicas pretas que você conjura custam {1} a menos para conjurar.
294,Pearl Medallion,White spells you cast cost {1} less to cast.,As mágicas brancas que você conjura custam {1} a menos para conjurar.
295,Ruby Medallion,Red spells you cast cost {1} less to cast.,As mágicas vermelhas que você conjura custam {1} a menos para conjurar.
296,Sapphire Medallion,Blue spells you cast cost {1} less to cast.,As mágicas azuis que você conjura custam {1} a menos para conjurar.
298,Worn Powerstone,"Worn Powerstone enters the battlefield tapped.
{T}: Add {C}{C}.",Pedra de Energia Desgastada entra no campo de batalha virada.<br>{T}: Adicione {C}{C}.
299,Barbarian Ring,"{T}: Add {R}. Barbarian Ring deals 1 damage to you.
Threshold — {R}, {T}, Sacrifice Barbarian Ring: It deals 2 damage to any target. Activate only if seven or more cards are in your graveyard.","{T}: Adicione {R}. Anel Bárbaro causa 1 ponto de dano a você.<br>Limiar — {R}, {T}, Sacrifique Anel Bárbaro: Causa 2 pontos de dano a qualquer alvo. Ative apenas se houver sete ou mais cards em seu cemitério."
300,Cephalid Coliseum,"{T}: Add {U}. Cephalid Coliseum deals 1 damage to you.
Threshold — {U}, {T}, Sacrifice Cephalid Coliseum: Target player draws three cards, then discards three cards. Activate only if seven or more cards are in your graveyard.","{T}: Adicione {U}. Cephalid Coliseum causa 1 ponto de dano a você.<br>Limiar — {U}, {T}, sacrifique Cephalid Coliseum: O jogador alvo compra três cartas e depois descarta três cartas. Ative apenas se houver sete ou mais cards em seu cemitério."
301,Deserted Temple,"{T}: Add {C}.
{1}, {T}: Untap target land.","{T}: Adicione {C}.<br>{1}, {T}: Desvire o terreno alvo."
309,Snow-Covered Wastes,{T}: Add {C}.,{T}: Adicione {C}.
320,Echoes of Eternity,"If a triggered ability of a colorless spell you control or another colorless permanent you control triggers, that ability triggers an additional time.
Whenever you cast a colorless spell, copy it. You may choose new targets for the copy. (A copy of a permanent spell becomes a token.)","Se uma habilidade desencadeada de uma mágica incolor que você controla ou outra permanente incolor que você controla for desencadeada, essa habilidade será desencadeada uma vez adicional.<br>Sempre que você conjurar um feitiço incolor, copie-o. Você pode escolher novos alvos para a cópia. (Uma cópia de uma mágica permanente torna-se uma ficha.)"
321,Flare of Fortitude,"You may sacrifice a nontoken white creature rather than pay this spell's mana cost.
Until end of turn, your life total can't change, and permanents you control gain hexproof and indestructible.","Você pode sacrificar uma criatura branca que não seja uma ficha em vez de pagar o custo de mana desta mágica.<br>Até o final do turno, seu total de pontos de vida não pode mudar e as permanentes que você controla ganham resistência à magia e indestrutíveis."
323,Orim's Chant,"Kicker {W} (You may pay an additional {W} as you cast this spell.)
Target player can't cast spells this turn. If this spell was kicked, creatures can't attack this turn.","Reforçador {W} (Você pode pagar um valor adicional de {W} ao conjurar esta mágica.)<br>O jogador alvo não pode conjurar mágicas neste turno. Se esta mágica foi reforçada, as criaturas não podem atacar neste turno."
324,White Orchid Phantom,"Flying, first strike
When White Orchid Phantom enters the battlefield, destroy up to one target nonbasic land. Its controller may search their library for a basic land card, put it onto the battlefield tapped, then shuffle.","Voar, primeiro ataque<br>Quando White Orchid Phantom entrar no campo de batalha, destrua até um terreno alvo não básico. Seu controlador pode procurar em seu grimório um card de terreno básico, colocá-lo no campo de batalha virado e depois embaralhar."
326,Flare of Denial,"You may sacrifice a nontoken blue creature rather than pay this spell's mana cost.
Counter target spell.",Você pode sacrificar uma criatura azul que não seja uma ficha em vez de pagar o custo de mana desta mágica.<br>Anule a mágica alvo.
327,Strix Serenade,"Counter target artifact, creature, or planeswalker spell. Its controller creates a 2/2 blue Bird creature token with flying.","Anula a mágica de artefato, criatura ou planeswalker alvo. Seu controlador cria uma ficha de criatura azul 2/2 do tipo Ave com voar."
329,Volatile Stormdrake,"Flying, hexproof from activated and triggered abilities
When Volatile Stormdrake enters the battlefield, exchange control of Volatile Stormdrake and target creature an opponent controls. If you do, you get {E}{E}{E}{E}, then sacrifice that creature unless you pay an amount of {E} equal to its mana value.","Voar, resistência à magia de habilidades ativadas e desencadeadas<br>Quando Stormdrake Volátil entrar no campo de batalha, troque o controle de Stormdrake Volátil e da criatura alvo que um oponente controla. Se fizer isso, você receberá {E}{E}{E}{E} e depois sacrificará aquela criatura, a menos que pague uma quantia de {E} igual ao seu valor de mana."
330,Chthonian Nightmare,"When Chthonian Nightmare enters the battlefield, you get {E}{E}{E} (three energy counters).
Pay X {E}, Sacrifice a creature, Return Chthonian Nightmare to its owner's hand: Return target creature card with mana value X from your graveyard to the battlefield. Activate only as a sorcery.","Quando Pesadelo Chthoniano entra no campo de batalha, você recebe {E}{E}{E} (três marcadores de energia).<br>Pague X {E}, sacrifique uma criatura, devolva Pesadelo Chthoniano para a mão de seu dono: Devolva o card de criatura alvo com valor de mana X de seu cemitério para o campo de batalha. Ative apenas como um feitiço."
331,Flare of Malice,"You may sacrifice a nontoken black creature rather than pay this spell's mana cost.
Each opponent sacrifices a creature or planeswalker with the greatest mana value among creatures and planeswalkers they control.",Você pode sacrificar uma criatura preta que não seja uma ficha em vez de pagar o custo de mana desta mágica.<br>Cada oponente sacrifica uma criatura ou planeswalker com o maior valor de mana entre as criaturas e planeswalkers que ele controla.
333,Flare of Duplication,"You may sacrifice a nontoken red creature rather than pay this spell's mana cost.
Copy target instant or sorcery spell. You may choose new targets for the copy.",Você pode sacrificar uma criatura vermelha que não seja uma ficha em vez de pagar o custo de mana desta mágica.<br>Copie a mágica instantânea ou feitiço alvo. Você pode escolher novos alvos para a cópia.
335,Powerbalance,"Whenever an opponent casts a spell, you may reveal the top card of your library. If you do, you may cast that card without paying its mana cost if the two spells have the same mana value.","Sempre que um oponente conjurar uma mágica, você poderá revelar o card do topo do seu grimório. Se fizer isso, você poderá conjurar aquele card sem pagar seu custo de mana se as duas mágicas tiverem o mesmo valor de mana."
336,Wheel of Potential,"You get {E}{E}{E} (three energy counters), then you may pay X {E}.
Each player may exile their hand and draw X cards. If X is 7 or more, you may play cards you own exiled this way until the end of your next turn.","Você recebe {E}{E}{E} (três marcadores de energia) e pode pagar X {E}.<br>Cada jogador pode exilar sua mão e comprar X cartas. Se X for 7 ou mais, você poderá jogar cartas que você possui exiladas desta forma até o final do seu próximo turno."
338,Flare of Cultivation,"You may sacrifice a nontoken green creature rather than pay this spell's mana cost.
Search your library for up to two basic land cards, reveal those cards, put one onto the battlefield tapped and the other into your hand, then shuffle.","Você pode sacrificar uma criatura verde que não seja uma ficha em vez de pagar o custo de mana desta mágica.<br>Procure em seu grimório por até dois cards de terreno básico, revele esses cards, coloque um no campo de batalha virado e o outro em sua mão e depois embaralhe."
343,Kaalia of the Vast,"Flying
Whenever Kaalia of the Vast attacks an opponent, you may put an Angel, Demon, or Dragon creature card from your hand onto the battlefield tapped and attacking that opponent.","Voar<br>Toda vez que Kaalia of the Vast ataca um oponente, você pode colocar no campo de batalha um card de criatura Anjo, Demônio ou Dragão de sua mão virado e atacando aquele oponente."
344,Psychic Frog,"Whenever Psychic Frog deals combat damage to a player or planeswalker, draw a card.
Discard a card: Put a +1/+1 counter on Psychic Frog.
Exile three cards from your graveyard: Psychic Frog gains flying until end of turn.","Toda vez que Sapo Psíquico causar dano de combate a um jogador ou planeswalker, compre um card.<br>Descarte um card: Coloque um marcador +1/+1 em Psychic Frog.<br>Exile três cards de seu cemitério: Sapo Psíquico ganha voar até o final do turno."
345,Emerald Medallion,Green spells you cast cost {1} less to cast.,As mágicas verdes que você conjura custam {1} a menos para conjurar.
346,Jet Medallion,Black spells you cast cost {1} less to cast.,As mágicas pretas que você conjura custam {1} a menos para conjurar.
347,Pearl Medallion,White spells you cast cost {1} less to cast.,As mágicas brancas que você conjura custam {1} a menos para conjurar.
348,Ruby Medallion,Red spells you cast cost {1} less to cast.,As mágicas vermelhas que você conjura custam {1} a menos para conjurar.
349,Sapphire Medallion,Blue spells you cast cost {1} less to cast.,As mágicas azuis que você conjura custam {1} a menos para conjurar.
352,Bloodstained Mire,"{T}, Pay 1 life, Sacrifice Bloodstained Mire: Search your library for a Swamp or Mountain card, put it onto the battlefield, then shuffle.","{T}, Pague 1 ponto de vida, Sacrifique Pântano Manchado de Sangue: Procure um card de Pântano ou Montanha em seu grimório, coloque-o no campo de batalha e depois embaralhe."
353,Flooded Strand,"{T}, Pay 1 life, Sacrifice Flooded Strand: Search your library for a Plains or Island card, put it onto the battlefield, then shuffle.","{T}, pague 1 ponto de vida, sacrifique Praia Inundada: Procure um card de Planície ou Ilha em seu grimório, coloque-o no campo de batalha e depois embaralhe."
356,Polluted Delta,"{T}, Pay 1 life, Sacrifice Polluted Delta: Search your library for an Island or Swamp card, put it onto the battlefield, then shuffle.","{T}, pague 1 ponto de vida, sacrifique Polluted Delta: Procure em seu grimório por um card de Ilha ou Pântano, coloque-o no campo de batalha e depois embaralhe."
358,Spymaster's Vault,"Spymaster's Vault enters the battlefield tapped unless you control a Swamp.
{T}: Add {B}.
{B}, {T}: Target creature you control connives X, where X is the number of creatures that died this turn. (Draw X cards, then discard X cards. Put a +1/+1 counter on that creature for each nonland card discarded this way.)","Cofre do Spymaster entra no campo de batalha virado, a menos que você controle um Pântano.<br>{T}: Adicione {B}.<br>{B}, {T}: A criatura alvo que você controla é conivente com X, onde X é o número de criaturas que morreram neste turno. (Compre X cards e depois descarte X cards. Coloque um marcador +1/+1 naquela criatura para cada card que não seja um terreno descartado dessa forma.)"
359,Ugin's Labyrinth,"Imprint — When Ugin's Labyrinth enters the battlefield, you may exile a colorless card with mana value 7 or greater from your hand.
{T}: Add {C}. If a card is exiled with Ugin's Labyrinth, add {C}{C} instead.
{T}: Return the exiled card to its owner's hand.","Estampar — Quando Labirinto de Ugin entra no campo de batalha, você pode exilar um card incolor com valor de mana igual ou superior a 7 de sua mão.<br>{T}: Adicione {C}. Se um card for exilado com o Labirinto de Ugin, adicione {C}{C} em vez disso.<br>{T}: Devolva o card exilado para a mão de seu dono."
360,Windswept Heath,"{T}, Pay 1 life, Sacrifice Windswept Heath: Search your library for a Forest or Plains card, put it onto the battlefield, then shuffle.","{T}, pague 1 ponto de vida, sacrifique Windswept Heath: Procure em seu grimório por um card de Floresta ou Planície, coloque-o no campo de batalha e depois embaralhe."
361,Wooded Foothills,"{T}, Pay 1 life, Sacrifice Wooded Foothills: Search your library for a Mountain or Forest card, put it onto the battlefield, then shuffle.","{T}, pague 1 ponto de vida, sacrifique Contrafortes Arborizados: Procure um card de Montanha ou Floresta em seu grimório, coloque-o no campo de batalha e depois embaralhe."
362,"Herigast, Erupting Nullkite","Emerge {6}{R}{R} (You may cast this spell by sacrificing a creature and paying the emerge cost reduced by that creature's mana value.)
When you cast this spell, you may exile your hand. If you do, draw three cards.
Flying
Each creature spell you cast has emerge. The emerge cost is equal to its mana cost.","Emergir {6}{R}{R} (Você pode conjurar esta mágica sacrificando uma criatura e pagando o custo de emergir reduzido pelo valor de mana daquela criatura.)<br>Ao conjurar esta magia, você pode exilar sua mão. Se fizer isso, compre três cartas.<br>Voar<br>Cada feitiço de criatura que você conjurou emerge. O custo de emergência é igual ao seu custo de mana."
