numero,nome,texto_ingles,traduzido
1,Another Round,"Exile any number of creatures you control, then return them to the battlefield under their owner's control. Then repeat this process X more times.","Exile qualquer número de criaturas que você controla e depois devolva-as ao campo de batalha sob o controle de seu dono. Em seguida, repita esse processo mais X vezes."
2,Archangel of Tithes,"Flying
As long as Archangel of Tithes is untapped, creatures can't attack you or planeswalkers you control unless their controller pays {1} for each of those creatures.
As long as Archangel of Tithes is attacking, creatures can't block unless their controller pays {1} for each of those creatures.","Vôo
Enquanto Archangel of Tithes estiver desvirado, as criaturas não poderão atacar você ou os planeswalkers que você controla, a menos que o controlador delas pague {1} para cada uma dessas criaturas.
Enquanto Arcanjo dos Dízimos estiver atacando, as criaturas não poderão bloquear, a menos que seu controlador pague {1} para cada uma dessas criaturas."
3,Armored Armadillo,"Ward {1} (Whenever this creature becomes the target of a spell or ability an opponent controls, counter it unless that player pays {1}.)
{3}{W}: Armored Armadillo gets +X/+0 until end of turn, where X is its toughness.","Proteger {1} (Toda vez que esta criatura se tornar alvo de uma mágica ou habilidade que um oponente controla, anule-a, a menos que aquele jogador pague {1}.)
{3}{W}: Tatu Blindado recebe +X/+0 até o final do turno, onde X é sua resistência."
4,Aven Interrupter,"Flash
Flying
When Aven Interrupter enters the battlefield, exile target spell. It becomes plotted. (Its owner may cast it as a sorcery on a later turn without paying its mana cost.)
Spells your opponents cast from graveyards or from exile cost {2} more to cast.","Clarão
Vôo
Quando Interruptor Aviano entrar no campo de batalha, exile a mágica alvo. Torna-se planejado. (Seu dono pode lançá-lo como um feitiço em um turno posterior sem pagar seu custo de mana.)
As mágicas que seus oponentes conjuram dos cemitérios ou do exílio custam {2} a mais para serem conjuradas."
5,Bounding Felidar,"Whenever Bounding Felidar attacks while saddled, put a +1/+1 counter on each other creature you control. You gain 1 life for each of those creatures.
Saddle 2 (Tap any number of other creatures you control with total power 2 or more: This Mount becomes saddled until end of turn. Saddle only as a sorcery.)","Toda vez que Felidar Saltitante atacar enquanto estiver selado, coloque um marcador +1/+1 em cada outra criatura que você controla. Você ganha 1 ponto de vida para cada uma dessas criaturas.
Sela 2 (Vire qualquer número de outras criaturas que você controla com poder total igual ou superior a 2: Esta montaria fica selada até o final do turno. Sela apenas como um feitiço.)"
6,Bovine Intervention,Destroy target artifact or creature. Its controller creates a 2/2 white Ox creature token.,Destrua o artefato ou criatura alvo. Seu controlador cria uma ficha de criatura branca 2/2 do tipo Boi.
7,Bridled Bighorn,"Vigilance
Whenever Bridled Bighorn attacks while saddled, create a 1/1 white Sheep creature token.
Saddle 2 (Tap any number of other creatures you control with total power 2 or more: This Mount becomes saddled until end of turn. Saddle only as a sorcery.)","Vigilância
Toda vez que Bighorn Bridled atacar enquanto estiver selado, crie uma ficha de criatura branca 1/1 do tipo Ovelha.
Sela 2 (Vire qualquer número de outras criaturas que você controla com poder total igual ou superior a 2: Esta montaria fica selada até o final do turno. Sela apenas como um feitiço.)"
8,Claim Jumper,"Vigilance
When Claim Jumper enters the battlefield, if an opponent controls more lands than you, you may search your library for a Plains card and put it onto the battlefield tapped. Then if an opponent controls more lands than you, repeat this process once. If you search your library this way, shuffle.","Vigilância
Quando Claim Jumper entra no campo de batalha, se um oponente controlar mais terrenos que você, você poderá procurar em seu grimório por um card de Planície e colocá-lo no campo de batalha virado. Então, se um oponente controlar mais terrenos que você, repita esse processo uma vez. Se você pesquisar em seu grimório dessa maneira, embaralhe."
9,Dust Animus,"Flying
If you control five or more untapped lands, Dust Animus enters the battlefield with two +1/+1 counters and a lifelink counter on it.
Plot {1}{W} (You may pay {1}{W} and exile this card from your hand. Cast it as a sorcery on a later turn without paying its mana cost. Plot only as a sorcery.)","Vôo
Se você controlar cinco ou mais terrenos desvirados, Dust Animus entra no campo de batalha com dois marcadores +1/+1 e um marcador de vínculo com a vida.
Traçar {1}{W} (Você pode pagar {1}{W} e exilar este card de sua mão. Conjure-o como um feitiço em um turno posterior sem pagar seu custo de mana. Trate apenas como um feitiço.)"
10,Eriette's Lullaby,Destroy target tapped creature. You gain 2 life.,Destrua a criatura virada alvo. Você ganha 2 pontos de vida.
11,Final Showdown,"Spree (Choose one or more additional costs.)
+ {1} — All creatures lose all abilities until end of turn.
+ {1} — Choose a creature you control. It gains indestructible until end of turn.
+ {3}{W}{W} — Destroy all creatures.","Spree (Escolha um ou mais custos adicionais.)
+ {1} — Todas as criaturas perdem todas as habilidades até o final do turno.
+ {1} — Escolha uma criatura que você controla. Ele ganha indestrutível até o final do turno.
+ {3}{W}{W} — Destrua todas as criaturas."
12,"Fortune, Loyal Steed","When Fortune, Loyal Steed enters the battlefield, scry 2.
Whenever Fortune attacks while saddled, at end of combat, exile it and up to one creature that saddled it this turn, then return those cards to the battlefield under their owner's control.
Saddle 1","Quando Fortuna, Corcel Leal, entrar no campo de batalha, use vidência 2.
Toda vez que Fortuna atacar enquanto estiver selado, no final do combate, exile-o e até uma criatura que o selou neste turno e, em seguida, devolva esses cards ao campo de batalha sob o controle de seu dono.
Sela 1"
13,Frontier Seeker,"When Frontier Seeker enters the battlefield, look at the top five cards of your library. You may reveal a Mount creature card or a Plains card from among them and put it into your hand. Put the rest on the bottom of your library in a random order.","Quando Frontier Seeker entrar no campo de batalha, olhe os cinco cards do topo de seu grimório. Você pode revelar uma carta de criatura Montaria ou uma carta de Planície dentre elas e colocá-la em sua mão. Coloque o restante no fundo do seu grimório em ordem aleatória."
14,Getaway Glamer,"Spree (Choose one or more additional costs.)
+ {1} — Exile target nontoken creature. Return it to the battlefield under its owner's control at the beginning of the next end step.
+ {2} — Destroy target creature if no other creature has greater power.","Spree (Escolha um ou mais custos adicionais.)
+ {1} — Exile a criatura alvo que não seja uma ficha. Devolva-o ao campo de batalha sob o controle de seu dono no início da próxima etapa final.
+ {2} — Destrua a criatura alvo se nenhuma outra criatura tiver poder maior."
15,High Noon,"Each player can't cast more than one spell each turn.
{4}{R}, Sacrifice High Noon: It deals 5 damage to any target.","Cada jogador não pode lançar mais de um feitiço por turno.
{4}{R}, Sacrifique Meio-dia: Causa 5 pontos de dano a qualquer alvo."
16,Holy Cow,"Flash
Flying
When Holy Cow enters the battlefield, you gain 2 life and scry 1. (Look at the top card of your library. You may put that card on the bottom.)","Clarão
Vôo
Quando Vaca Sagrada entra no campo de batalha, você ganha 2 pontos de vida e vidência 1. (Olhe o card do topo do seu grimório. Você pode colocar esse card no fundo.)"
17,Inventive Wingsmith,"At the beginning of your end step, if you haven't cast a spell from your hand this turn and Inventive Wingsmith doesn't have a flying counter on it, put a flying counter on it.","No início de sua etapa final, se você não tiver conjurado uma mágica de sua mão neste turno e o Ferreiro Inventivo não tiver um marcador de vôo, coloque um marcador de vôo nele."
18,Lassoed by the Law,"When Lassoed by the Law enters the battlefield, exile target nonland permanent an opponent controls until Lassoed by the Law leaves the battlefield.
When Lassoed by the Law enters the battlefield, create a 1/1 red Mercenary creature token with ""{T}: Target creature you control gets +1/+0 until end of turn. Activate only as a sorcery.""","Quando Laçado pela Lei entrar no campo de batalha, exile a permanente alvo que um oponente controla que não seja um terreno até que Laçado pela Lei deixe o campo de batalha.
Quando Laçado pela Lei entrar no campo de batalha, crie uma ficha de criatura vermelha 1/1 do tipo Mercenário com ""{T}: A criatura alvo que você controla recebe +1/+0 até o final do turno. Ative somente como um feitiço."""
19,Mystical Tether,"You may cast Mystical Tether as though it had flash if you pay {2} more to cast it.
When Mystical Tether enters the battlefield, exile target artifact or creature an opponent controls until Mystical Tether leaves the battlefield.","Você pode conjurar Mystical Tether como se tivesse clarão se pagar {2} a mais para lançá-lo.
Quando Mystical Tether entrar no campo de batalha, exile o artefato alvo ou a criatura alvo que um oponente controla até que Mystical Tether deixe o campo de batalha."
20,Nurturing Pixie,"Flying
When Nurturing Pixie enters the battlefield, return up to one target non-Faerie, nonland permanent you control to its owner's hand. If a permanent was returned this way, put a +1/+1 counter on Nurturing Pixie.","Vôo
Quando Nurturing Pixie entrar no campo de batalha, devolva até uma permanente alvo que não seja Faerie e não seja um terreno que você controla para a mão de seu dono. Se uma permanente foi devolvida desta forma, coloque um marcador +1/+1 em Nurturing Pixie."
21,Omenport Vigilante,"Omenport Vigilante has double strike as long as you've committed a crime this turn. (Targeting opponents, anything they control, and/or cards in their graveyards is a crime.)","Omenport Vigilante tem golpe duplo desde que você tenha cometido um crime neste turno. (Alvejar oponentes, qualquer coisa que eles controlem e/ou cards em seus cemitérios é crime.)"
22,One Last Job,"Spree (Choose one or more additional costs.)
+ {2} — Return target creature card from your graveyard to the battlefield.
+ {1} — Return target Mount or Vehicle card from your graveyard to the battlefield.
+ {1} — Return target Aura or Equipment card from your graveyard to the battlefield attached to a creature you control.","Spree (Escolha um ou mais custos adicionais.)
+ {2} — Devolva o card de criatura alvo de seu cemitério para o campo de batalha.
+ {1} — Devolva o card alvo de Montaria ou Veículo de seu cemitério para o campo de batalha.
+ {1} — Devolva o card de Aura ou Equipamento alvo de seu cemitério para o campo de batalha anexado a uma criatura que você controla."
23,Outlaw Medic,"Lifelink
When Outlaw Medic dies, draw a card.","Vínculo com a vida
Quando Outlaw Medic morrer, compre um card."
24,Prairie Dog,"Lifelink
At the beginning of your end step, if you haven't cast a spell from your hand this turn, put a +1/+1 counter on Prairie Dog.
{4}{W}: Until end of turn, if you would put one or more +1/+1 counters on a creature you control, put that many plus one +1/+1 counters on it instead.","Vínculo com a vida
No início de sua etapa final, se você não tiver conjurado uma mágica de sua mão neste turno, coloque um marcador +1/+1 em Prairie Dog.
{4}{W}: Até o final do turno, se você fosse colocar um ou mais marcadores +1/+1 em uma criatura que você controla, em vez disso, coloque aquela quantidade de marcadores +1/+1 nela."
25,Prosperity Tycoon,"When Prosperity Tycoon enters the battlefield, create a 1/1 red Mercenary creature token with ""{T}: Target creature you control gets +1/+0 until end of turn. Activate only as a sorcery.""
{2}, Sacrifice a token: Prosperity Tycoon gains indestructible until end of turn. Tap it. (Damage and effects that say ""destroy"" don't destroy it.)","Quando Magnata da Prosperidade entrar no campo de batalha, crie uma ficha de criatura vermelha 1/1 do tipo Mercenário com ""{T}: A criatura alvo que você controla recebe +1/+0 até o final do turno. Ative somente como um feitiço.""
{2}, Sacrifique uma ficha: Magnata da Prosperidade ganha indestrutível até o final do turno. Toque nele. (Dano e efeitos que dizem “destruir” não o destroem.)"
26,Requisition Raid,"Spree (Choose one or more additional costs.)
+ {1} — Destroy target artifact.
+ {1} — Destroy target enchantment.
+ {1} — Put a +1/+1 counter on each creature target player controls.","Spree (Escolha um ou mais custos adicionais.)
+ {1} — Destrua o artefato alvo.
+ {1} — Destrua o encantamento alvo.
+ {1} — Coloque um marcador +1/+1 em cada criatura que o jogador alvo controla."
27,Rustler Rampage,"Spree (Choose one or more additional costs.)
+ {1} — Untap all creatures target player controls.
+ {1} — Target creature gains double strike until end of turn.","Spree (Escolha um ou mais custos adicionais.)
+ {1} — Desvire todas as criaturas que o jogador alvo controla.
+ {1} — A criatura alvo ganha golpe duplo até o final do turno."
28,Shepherd of the Clouds,"Flying, vigilance
When Shepherd of the Clouds enters the battlefield, return target permanent card with mana value 3 or less from your graveyard to your hand. Return that card to the battlefield instead if you control a Mount.","Voando, vigilância
Quando Pastor das Nuvens entrar no campo de batalha, devolva o card de permanente alvo com valor de mana igual ou inferior a 3 de seu cemitério para sua mão. Em vez disso, devolva aquele card para o campo de batalha se você controlar uma Montaria."
29,Sheriff of Safe Passage,"Sheriff of Safe Passage enters the battlefield with a +1/+1 counter on it plus an additional +1/+1 counter on it for each other creature you control.
Plot {1}{W} (You may pay {1}{W} and exile this card from your hand. Cast it as a sorcery on a later turn without paying its mana cost. Plot only as a sorcery.)","Sheriff of Safe Passage entra no campo de batalha com um marcador +1/+1 mais um marcador +1/+1 adicional para cada outra criatura que você controla.
Traçar {1}{W} (Você pode pagar {1}{W} e exilar este card de sua mão. Conjure-o como um feitiço em um turno posterior sem pagar seu custo de mana. Trate apenas como um feitiço.)"
30,Stagecoach Security,"When Stagecoach Security enters the battlefield, creatures you control get +1/+1 and gain vigilance until end of turn.
Plot {3}{W} (You may pay {3}{W} and exile this card from your hand. Cast it as a sorcery on a later turn without paying its mana cost. Plot only as a sorcery.)","Quando Stagecoach Security entra no campo de batalha, as criaturas que você controla recebem +1/+1 e ganham vigilância até o final do turno.
Traçar {3}{W} (Você pode pagar {3}{W} e exilar este card de sua mão. Conjure-o como um feitiço em um turno posterior sem pagar seu custo de mana. Trate apenas como um feitiço.)"
31,Steer Clear,Steer Clear deals 2 damage to target attacking or blocking creature. Steer Clear deals 4 damage to that creature instead if you controlled a Mount as you cast this spell.,"Steer Clear causa 2 pontos de dano à criatura atacante ou bloqueadora alvo. Em vez disso, Steer Clear causa 4 pontos de dano àquela criatura se você controlava uma Montaria ao lançar esta mágica."
32,Sterling Keykeeper,"{2}, {T}: Tap target non-Mount creature.","{2}, {T}: Vire a criatura alvo que não seja Montaria."
33,Sterling Supplier,"Flying
When Sterling Supplier enters the battlefield, put a +1/+1 counter on another target creature you control.","Vôo
Quando Fornecedor Esterlino entrar no campo de batalha, coloque um marcador +1/+1 em outra criatura alvo que você controla."
34,Take Up the Shield,"Put a +1/+1 counter on target creature. It gains lifelink and indestructible until end of turn. (Damage and effects that say ""destroy"" don't destroy it.)",Coloque um marcador +1/+1 na criatura alvo. Ele ganha vínculo com a vida e é indestrutível até o final do turno. (Dano e efeitos que dizem “destruir” não o destroem.)
35,Thunder Lasso,"When Thunder Lasso enters the battlefield, attach it to target creature you control.
Equipped creature gets +1/+1.
Whenever equipped creature attacks, tap target creature defending player controls.
Equip {2}","Quando Thunder Lasso entrar no campo de batalha, anexe-o à criatura alvo que você controla.
A criatura equipada recebe +1/+1.
Sempre que a criatura equipada atacar, vire os controles do jogador defensor da criatura alvo.
Equipar {2}"
36,Trained Arynx,"Whenever Trained Arynx attacks while saddled, it gains first strike until end of turn. Scry 1. (Look at the top card of your library. You may put that card on the bottom.)
Saddle 2 (Tap any number of other creatures you control with total power 2 or more: This Mount becomes saddled until end of turn. Saddle only as a sorcery.)","Sempre que Arynx Treinada ataca enquanto está selada, ela ganha iniciativa até o final do turno. Vidência 1. (Olhe o card do topo do seu grimório. Você pode colocar esse card no fundo.)
Sela 2 (Vire qualquer número de outras criaturas que você controla com poder total igual ou superior a 2: Esta montaria fica selada até o final do turno. Sela apenas como um feitiço.)"
37,Vengeful Townsfolk,"Whenever one or more other creatures you control die, put a +1/+1 counter on Vengeful Townsfolk.","Toda vez que uma ou mais criaturas que você controla morrerem, coloque um marcador +1/+1 em Vengeful Townsfolk."
38,Wanted Griffin,"Flying
When Wanted Griffin dies, create a 1/1 red Mercenary creature token with ""{T}: Target creature you control gets +1/+0 until end of turn. Activate only as a sorcery.""","Vôo
Quando Grifo Procurado morrer, crie uma ficha de criatura vermelha 1/1 do tipo Mercenário com ""{T}: A criatura alvo que você controla recebe +1/+0 até o final do turno. Ative somente como um feitiço."""
39,Archmage's Newt,"Whenever Archmage's Newt deals combat damage to a player, target instant or sorcery card in your graveyard gains flashback until end of turn. The flashback cost is equal to its mana cost. That card gains flashback {0} until end of turn instead if Archmage's Newt is saddled. (You may cast that card from your graveyard for its flashback cost. Then exile it.)
Saddle 3","Toda vez que Newt do Arquimago causar dano de combate a um jogador, o card de mágica instantânea ou feitiço alvo em seu cemitério ganha flashback até o final do turno. O custo do flashback é igual ao seu custo de mana. Em vez disso, aquele card ganha flashback {0} até o final do turno se Newt do Arquimago estiver selado. (Você pode conjurar aquele card de seu cemitério pagando seu custo de flashback. Depois exile-o.)
Sela 3"
40,Canyon Crab,"{1}{U}: Canyon Crab gets +2/-2 until end of turn.
At the beginning of your end step, if you haven't cast a spell from your hand this turn, draw a card, then discard a card.","{1}{U}: Canyon Crab recebe +2/-2 até o final do turno.
No início de sua etapa final, se você não tiver conjurado uma mágica de sua mão neste turno, compre um card e depois descarte um card."
41,Daring Thunder-Thief,"Flash
Daring Thunder-Thief enters the battlefield tapped.","Clarão
Daring Thunder-Thief entra no campo de batalha virado."
42,Deepmuck Desperado,"Whenever you commit a crime, each opponent mills three cards. This ability triggers only once each turn. (Targeting opponents, anything they control, and/or cards in their graveyards is a crime.)","Sempre que você comete um crime, cada oponente mói três cartas. Esta habilidade é desencadeada apenas uma vez por turno. (Alvejar oponentes, qualquer coisa que eles controlem e/ou cards em seus cemitérios é crime.)"
43,Djinn of Fool's Fall,"Flying
Plot {3}{U} (You may pay {3}{U} and exile this card from your hand. Cast it as a sorcery on a later turn without paying its mana cost. Plot only as a sorcery.)","Vôo
Traçar {3}{U} (Você pode pagar {3}{U} e exilar este card de sua mão. Conjure-o como um feitiço em um turno posterior sem pagar seu custo de mana. Trate apenas como um feitiço.)"
44,Double Down,"Whenever you cast an outlaw spell, copy that spell. (Assassins, Mercenaries, Pirates, Rogues, and Warlocks are outlaws. Copies of permanent spells become tokens.)","Sempre que você conjurar uma mágica de fora da lei, copie essa mágica. (Assassinos, Mercenários, Piratas, Ladinos e Bruxos são fora-da-lei. Cópias de feitiços permanentes tornam-se fichas.)"
45,Duelist of the Mind,"Flying, vigilance
Duelist of the Mind's power is equal to the number of cards you've drawn this turn.
Whenever you commit a crime, you may draw a card. If you do, discard a card. This ability triggers only once each turn.","Voando, vigilância
O poder do Duelista da Mente é igual ao número de cartas que você comprou neste turno.
Sempre que você cometer um crime, você pode comprar uma carta. Se fizer isso, descarte uma carta. Esta habilidade é desencadeada apenas uma vez por turno."
46,Emergent Haunting,"At the beginning of your end step, if you haven't cast a spell from your hand this turn and Emergent Haunting isn't a creature, it becomes a 3/3 Spirit creature with flying in addition to its other types.
{2}{U}: Surveil 1. (Look at the top card of your library. You may put it into your graveyard.)","No início de sua etapa final, se você não tiver conjurado uma mágica de sua mão neste turno e Assombração Emergente não for uma criatura, ela se tornará uma criatura 3/3 do tipo Espírito com voar além de seus outros tipos.
{2}{U}: Vigilância 1. (Olhe o card do topo de seu grimório. Você pode colocá-lo em seu cemitério.)"
47,Failed Fording,"Return target nonland permanent to its owner's hand. If you control a Desert, surveil 1. (Look at the top card of your library. You may put it into your graveyard.)","Devolva a permanente alvo que não seja um terreno para a mão de seu dono. Se você controla um Deserto, vigie 1. (Olhe o card do topo de seu grimório. Você pode colocá-lo em seu cemitério.)"
48,"Fblthp, Lost on the Range","Ward {2}
You may look at the top card of your library any time.
The top card of your library has plot. The plot cost is equal to its mana cost.
You may plot nonland cards from the top of your library.","Ala {2}
Você pode olhar o card do topo do seu grimório a qualquer momento.
A carta do topo do seu grimório tem enredo. O custo do enredo é igual ao seu custo de mana.
Você pode plotar cards que não sejam terrenos do topo de seu grimório."
49,Fleeting Reflection,"Target creature you control gains hexproof until end of turn. Untap that creature. Until end of turn, it becomes a copy of up to one other target creature.","A criatura alvo que você controla ganha resistência à magia até o final do turno. Desvire aquela criatura. Até o final do turno, ela se torna uma cópia de até uma outra criatura alvo."
50,"Geralf, the Fleshwright","Whenever you cast a spell during your turn other than your first spell that turn, create a 2/2 blue and black Zombie Rogue creature token.
Whenever a Zombie enters the battlefield under your control, put a +1/+1 counter on it for each other Zombie that entered the battlefield under your control this turn.","Toda vez que você conjurar uma mágica durante seu turno que não seja a primeira mágica daquele turno, crie uma ficha de criatura Zumbi Ladino azul e preta 2/2.
Toda vez que um Zumbi entrar no campo de batalha sob o seu controle, coloque nele um marcador +1/+1 para cada outro Zumbi que entrou no campo de batalha sob o seu controle neste turno."
51,Geyser Drake,"Flying
As long as it's not your turn, spells you cast cost {1} less to cast.","Vôo
Contanto que não seja o seu turno, as mágicas que você conjura custam {1} a menos para serem conjuradas."
52,Harrier Strix,"Flying
When Harrier Strix enters the battlefield, tap target permanent.
{2}{U}: Draw a card, then discard a card.","Vôo
Quando Harrier Strix entrar no campo de batalha, vire a permanente alvo.
{2}{U}: Compre um card e depois descarte um card."
53,Jailbreak Scheme,"Spree (Choose one or more additional costs.)
+ {3} — Put a +1/+1 counter on target creature. It can't be blocked this turn.
+ {2} — Target artifact or creature's owner puts it on the top or bottom of their library.","Spree (Escolha um ou mais custos adicionais.)
+ {3} — Coloque um marcador +1/+1 na criatura alvo. Não pode ser bloqueado neste turno.
+ {2} — O artefato alvo ou o dono da criatura coloca-o no topo ou no fundo de seu grimório."
54,The Key to the Vault,"Whenever equipped creature deals combat damage to a player, look at that many cards from the top of your library. You may exile a nonland card from among them. Put the rest on the bottom of your library in a random order. You may cast the exiled card without paying its mana cost.
Equip {2}{U}","Toda vez que a criatura equipada causar dano de combate a um jogador, olhe aquela quantidade de cards do topo de seu grimório. Você pode exilar um card que não seja um terreno dentre eles. Coloque o restante no fundo do seu grimório em ordem aleatória. Você pode conjurar o card exilado sem pagar seu custo de mana.
Equipar {2}{U}"
