numero,nome,texto_ingles,traduzido
1,Breaker of Creation,"When you cast this spell, you gain 1 life for each colorless permanent you control.
Hexproof from each color
Annihilator 2 (Whenever this creature attacks, defending player sacrifices two permanents.)","Ao conjurar esta mágica, você ganha 1 ponto de vida para cada permanente incolor que você controla.<br>À prova de magia de cada cor<br>Aniquilador 2 (Toda vez que esta criatura ataca, o jogador defensor sacrifica duas permanentes.)"
2,Devourer of Destiny,"You may reveal this card from your opening hand. If you do, at the beginning of your first upkeep, look at the top four cards of your library. You may put one of those cards back on top of your library. Exile the rest.
When you cast this spell, exile target permanent that's one or more colors.","Você pode revelar esta carta da sua mão inicial. Se fizer isso, no início de sua primeira manutenção, olhe os quatro cards do topo de seu grimório. Você pode colocar um desses cards de volta no topo do seu grimório. Exile o resto.<br>Quando você conjurar esta mágica, exile a permanente alvo que tenha uma ou mais cores."
4,Echoes of Eternity,"If a triggered ability of a colorless spell you control or another colorless permanent you control triggers, that ability triggers an additional time.
Whenever you cast a colorless spell, copy it. You may choose new targets for the copy. (A copy of a permanent spell becomes a token.)","Se uma habilidade desencadeada de uma mágica incolor que você controla ou outra permanente incolor que você controla for desencadeada, essa habilidade será desencadeada uma vez adicional.<br>Sempre que você conjurar um feitiço incolor, copie-o. Você pode escolher novos alvos para a cópia. (Uma cópia de uma mágica permanente torna-se uma ficha.)"
5,Eldrazi Ravager,"Annihilator 1 (Whenever this creature attacks, defending player sacrifices a permanent.)
Sacrifice two Eldrazi: Return Eldrazi Ravager from your graveyard to your hand.
Cycling {2} ({2}, Discard this card: Draw a card.)","Aniquilador 1 (Toda vez que esta criatura ataca, o jogador defensor sacrifica uma permanente.)<br>Sacrifique dois Eldrazi: Devolva Eldrazi Devastador de seu cemitério para sua mão.<br>Reciclar {2} ({2}, Descarte este card: Compre um card.)"
6,"Emrakul, the World Anew","When you cast this spell, gain control of all creatures target player controls.
Flying, protection from spells and from permanents that were cast this turn
When Emrakul, the World Anew leaves the battlefield, sacrifice all creatures you control.
Madness—Pay six {C}.","Ao conjurar esta mágica, você ganha o controle de todas as criaturas que o jogador alvo controla.<br>Voar, proteção contra mágicas e permanentes que foram conjuradas neste turno<br>Quando Emrakul, the World Anew sair do campo de batalha, sacrifique todas as criaturas que você controla.<br>Loucura – Pague seis {C}."
8,"Herigast, Erupting Nullkite","Emerge {6}{R}{R} (You may cast this spell by sacrificing a creature and paying the emerge cost reduced by that creature's mana value.)
When you cast this spell, you may exile your hand. If you do, draw three cards.
Flying
Each creature spell you cast has emerge. The emerge cost is equal to its mana cost.","Emergir {6}{R}{R} (Você pode conjurar esta mágica sacrificando uma criatura e pagando o custo de emergir reduzido pelo valor de mana daquela criatura.)<br>Ao conjurar esta magia, você pode exilar sua mão. Se fizer isso, compre três cartas.<br>Voar<br>Cada feitiço de criatura que você conjurou emerge. O custo de emergência é igual ao seu custo de mana."
9,It That Heralds the End,"Colorless spells you cast with mana value 7 or greater cost {1} less to cast.
Other colorless creatures you control get +1/+1.",As mágicas incolores que você conjura com custo de mana igual ou superior a 7 custam {1} a menos para serem conjuradas.<br>As outras criaturas incolores que você controla recebem +1/+1.
10,"Kozilek, the Broken Reality","When you cast this spell, up to two target players each manifest two cards from their hands. For each card manifested this way, you draw a card. (To manifest a card, put it onto the battlefield face down as a 2/2 creature. Turn it face up any time for its mana cost if it's a creature card.)
Other colorless creatures you control get +3/+2.","Quando você conjura esta mágica, até dois jogadores alvo manifestam, cada um, duas cartas de suas mãos. Para cada carta manifestada desta forma, você compra uma carta. (Para manifestar um card, coloque-o no campo de batalha com a face voltada para baixo como uma criatura 2/2. Vire-o com a face para cima a qualquer momento pagando seu custo de mana se for um card de criatura.)<br>As outras criaturas incolores que você controla recebem +3/+2."
12,Null Elemental Blast,"Choose one —
• Counter target multicolored spell.
• Destroy target multicolored permanent.",Escolha um -<br>• Anule o feitiço multicolorido alvo.<br>• Destrua a permanente alvo multicolorida.
13,Nulldrifter,"When you cast this spell, draw two cards.
Flying
Annihilator 1 (Whenever this creature attacks, defending player sacrifices a permanent.)
Evoke {2}{U} (You may cast this spell for its evoke cost. If you do, it's sacrificed when it enters the battlefield.)","Ao conjurar esta mágica, compre duas cartas.<br>Voar<br>Aniquilador 1 (Toda vez que esta criatura ataca, o jogador defensor sacrifica uma permanente.)<br>Evocar {2}{U} (Você pode conjurar esta mágica pagando seu custo de evocar. Se isso acontecer, ela será sacrificada ao entrar no campo de batalha.)"
15,"Ulamog, the Defiler","When you cast this spell, target opponent exiles half their library, rounded up.
Ward—Sacrifice two permanents.
Ulamog, the Defiler enters the battlefield with a number of +1/+1 counters on it equal to the greatest mana value among cards in exile.
Ulamog has annihilator X, where X is the number of +1/+1 counters on it.","Quando você conjura esta mágica, o oponente alvo exila metade de seu grimório, arredondado para cima.<br>Ward – Sacrifique duas permanentes.<br>Ulamog, o Profanador, entra no campo de batalha com um número de marcadores +1/+1 igual ao maior valor de mana entre os cards no exílio.<br>Ulamog tem o aniquilador X, onde X é o número de marcadores +1/+1 nele."
20,Argent Dais,"Argent Dais enters the battlefield with two oil counters on it.
Whenever two or more creatures attack, put an oil counter on Argent Dais.
{2}, {T}, Remove two oil counters from Argent Dais: Exile another target nonland permanent. Its controller draws two cards.","Argent Dais entra no campo de batalha com dois marcadores de óleo.<br>Sempre que duas ou mais criaturas atacarem, coloque um marcador de óleo em Argent Dais.<br>{2}, {T}, Remova dois marcadores de óleo de Argent Dais: Exile outra permanente alvo que não seja um terreno. Seu controlador compra duas cartas."
22,Dog Umbra,"Flash
Enchant creature
As long as another player controls enchanted creature, it can't attack or block. Otherwise, Dog Umbra has umbra armor. (If enchanted creature would be destroyed, instead remove all damage from it and destroy this Aura.)","Clarão<br>Encantar criatura<br>Enquanto outro jogador controlar a criatura encantada, ela não poderá atacar ou bloquear. Caso contrário, Dog Umbra possui armadura umbra. (Se a criatura encantada for destruída, em vez disso, remova todo o dano dela e destrua esta Aura.)"
24,Essence Reliquary,{T}: Return another target permanent you control and all Auras you control attached to it to their owner's hand. Activate only during your turn.,{T}: Devolva outra permanente alvo que você controla e todas as Auras que você controla anexadas a ela para a mão de seu dono. Ative apenas durante o seu turno.
26,Flare of Fortitude,"You may sacrifice a nontoken white creature rather than pay this spell's mana cost.
Until end of turn, your life total can't change, and permanents you control gain hexproof and indestructible.","Você pode sacrificar uma criatura branca que não seja uma ficha em vez de pagar o custo de mana desta mágica.<br>Até o final do turno, seu total de pontos de vida não pode mudar e as permanentes que você controla ganham resistência à magia e indestrutíveis."
39,"Pearl-Ear, Imperial Advisor","Lifelink
Enchantment spells you cast have affinity for Auras. (They cost {1} less to cast for each Aura you control.)
Whenever you cast an Aura spell that targets a modified permanent you control, draw a card. (Equipment, Auras you control, and counters are modifications.)","Vínculo com a vida<br>Os feitiços de encantamento que você conjura têm afinidade com Auras. (Eles custam {1} a menos para serem conjurados para cada Aura que você controla.)<br>Toda vez que você conjurar uma mágica de Aura que tenha como alvo uma permanente modificada que você controla, compre um card. (Equipamentos, Auras que você controla e contadores são modificações.)"
40,"Phelia, Exuberant Shepherd","Flash
Whenever Phelia, Exuberant Shepherd attacks, exile up to one other target nonland permanent. At the beginning of the next end step, return that card to the battlefield under its owner's control. If it entered under your control, put a +1/+1 counter on Phelia.","Clarão<br>Toda vez que Phelia, Pastor Exuberante, atacar, exile até uma outra permanente alvo que não seja um terreno. No início da próxima etapa final, devolva aquele card ao campo de batalha sob o controle de seu dono. Se ele entrou sob seu controle, coloque um marcador +1/+1 em Phelia."
45,Thraben Charm,"Choose one —
• Thraben Charm deals damage equal to twice the number of creatures you control to target creature.
• Destroy target enchantment.
• Exile any number of target players' graveyards.",Escolha um -<br>• Thraben Charm causa dano igual ao dobro do número de criaturas que você controla à criatura alvo.<br>• Destrua o encantamento do alvo.<br>• Exile qualquer número de cemitérios dos jogadores alvo.
46,Voltstorm Angel,"Flying
When Voltstorm Angel enters the battlefield, you get {E}{E}{E} (three energy counters).
At the beginning of combat on your turn, you may pay {E}{E}. When you do, choose one —
• Voltstorm Angel gains vigilance and lifelink until end of turn.
• Other creatures you control get +1/+1 until end of turn.","Voar<br>Quando Voltstorm Angel entra no campo de batalha, você recebe {E}{E}{E} (três marcadores de energia).<br>No início do combate no seu turno, você pode pagar {E}{E}. Ao fazer isso, escolha um -<br>• Anjo Voltstorm ganha vigilância e vínculo com a vida até o final do turno.<br>• As outras criaturas que você controla recebem +1/+1 até o final do turno."
47,White Orchid Phantom,"Flying, first strike
When White Orchid Phantom enters the battlefield, destroy up to one target nonbasic land. Its controller may search their library for a basic land card, put it onto the battlefield tapped, then shuffle.","Voar, primeiro ataque<br>Quando White Orchid Phantom entrar no campo de batalha, destrua até um terreno alvo não básico. Seu controlador pode procurar em seu grimório um card de terreno básico, colocá-lo no campo de batalha virado e depois embaralhar."
49,Wrath of the Skies,"You get X {E} (energy counters), then you may pay any amount of {E}. Destroy each artifact, creature, and enchantment with mana value less than or equal to the amount of {E} paid this way.","Você recebe X {E} (contadores de energia) e pode pagar qualquer quantia de {E}. Destrua cada artefato, criatura e encantamento com valor de mana menor ou igual à quantidade de {E} pago desta forma."
53,Brainsurge,"Draw four cards, then put two cards from your hand on top of your library in any order.",Compre quatro cards e depois coloque dois cards de sua mão no topo de seu grimório em qualquer ordem.
56,Corrupted Shapeshifter,"Devoid (This card has no color.)
As Corrupted Shapeshifter enters the battlefield, it becomes your choice of a 3/3 creature with flying, a 2/5 creature with vigilance, or a 0/12 creature with defender.","Desprovido (Este card não tem cor.)<br>Conforme Corrupted Shapeshifter entra no campo de batalha, ele se torna, à sua escolha, uma criatura 3/3 com voar, uma criatura 2/5 com vigilância ou uma criatura 0/12 com defensor."
62,Flare of Denial,"You may sacrifice a nontoken blue creature rather than pay this spell's mana cost.
Counter target spell.",Você pode sacrificar uma criatura azul que não seja uma ficha em vez de pagar o custo de mana desta mágica.<br>Anule a mágica alvo.
63,Harbinger of the Seas,Nonbasic lands are Islands.,As terras não básicas são ilhas.
65,Kozilek's Unsealing,"Devoid (This card has no color.)
Whenever you cast a creature spell with mana value 4, 5, or 6, create two 0/1 colorless Eldrazi Spawn creature tokens with ""Sacrifice this creature: Add {C}.""
Whenever you cast a creature spell with mana value 7 or greater, draw three cards.","Desprovido (Este card não tem cor.)<br>Toda vez que você conjurar uma mágica de criatura com valor de mana 4, 5 ou 6, crie duas fichas de criatura incolor 0/1 do tipo Prole Eldrazi com ""Sacrifique esta criatura: Adicione {C}.""<br>Toda vez que você conjurar uma mágica de criatura com custo de mana igual ou superior a 7, compre três cards."
66,Petrifying Meddler,"Devoid (This card has no color.)
When you cast this spell, tap up to one target creature and put a stun counter on it. (If a permanent with a stun counter would become untapped, remove one from it instead.)
Reach","Desprovido (Este card não tem cor.)<br>Ao conjurar esta mágica, vire até uma criatura alvo e coloque um marcador de atordoamento nela. (Se uma permanente com um marcador de atordoamento ficar desvirada, em vez disso, remova um dela.)<br>Alcançar"
69,Serum Visionary,"When Serum Visionary enters the battlefield, draw a card, then scry 2.","Quando Visionário do Soro entrar no campo de batalha, compre um card e depois use vidência 2."
70,Shadow of the Second Sun,"Enchant player
At the beginning of enchanted player's postcombat main phase, there is an additional beginning phase after this phase. (The end step happens after the added untap, upkeep, and draw steps.)","Encantar jogador<br>No início da fase principal pós-combate do jogador encantado, há uma fase inicial adicional após esta fase. (A etapa final acontece após as etapas adicionadas de desvirar, manter e comprar.)"
71,Strix Serenade,"Counter target artifact, creature, or planeswalker spell. Its controller creates a 2/2 blue Bird creature token with flying.","Anula a mágica de artefato, criatura ou planeswalker alvo. Seu controlador cria uma ficha de criatura azul 2/2 do tipo Ave com voar."
72,Tamiyo Meets the Story Circle,"(As this Saga enters and after your draw step, add a lore counter. Sacrifice after III.)
I — Until your next turn, whenever a creature attacks you or a planeswalker you control, it gets -2/-0 until end of turn.
II — Discard any number of cards, then investigate twice for each card discarded this way.
III — Shuffle up to three target cards from your graveyard into your library.","(Conforme esta Saga entra e após sua etapa de compra, adicione um marcador de conhecimento. Sacrifique após III.)<br>I — Até o seu próximo turno, sempre que uma criatura atacar você ou um planeswalker que você controla, ela receberá -2/-0 até o final do turno.<br>II — Descarte qualquer número de cartas e depois investigue duas vezes para cada carta descartada desta forma.<br>III — Embaralhe até três cards alvo de seu cemitério em seu grimório."
75,Tune the Narrative,Draw a card. You get {E}{E} (two energy counters).,Compre uma carta. Você recebe {E}{E} (dois marcadores de energia).
79,Volatile Stormdrake,"Flying, hexproof from activated and triggered abilities
When Volatile Stormdrake enters the battlefield, exchange control of Volatile Stormdrake and target creature an opponent controls. If you do, you get {E}{E}{E}{E}, then sacrifice that creature unless you pay an amount of {E} equal to its mana value.","Voar, resistência à magia de habilidades ativadas e desencadeadas<br>Quando Stormdrake Volátil entrar no campo de batalha, troque o controle de Stormdrake Volátil e da criatura alvo que um oponente controla. Se fizer isso, você receberá {E}{E}{E}{E} e depois sacrificará aquela criatura, a menos que pague uma quantia de {E} igual ao seu valor de mana."
83,Chthonian Nightmare,"When Chthonian Nightmare enters the battlefield, you get {E}{E}{E} (three energy counters).
Pay X {E}, Sacrifice a creature, Return Chthonian Nightmare to its owner's hand: Return target creature card with mana value X from your graveyard to the battlefield. Activate only as a sorcery.","Quando Pesadelo Chthoniano entra no campo de batalha, você recebe {E}{E}{E} (três marcadores de energia).<br>Pague X {E}, sacrifique uma criatura, devolva Pesadelo Chthoniano para a mão de seu dono: Devolva o card de criatura alvo com valor de mana X de seu cemitério para o campo de batalha. Ative apenas como um feitiço."
89,Drossclaw,"Living weapon (When this Equipment enters the battlefield, create a 0/0 black Phyrexian Germ creature token, then attach this to it.)
Equipped creature gets +1/+1.
Whenever equipped creature attacks, each opponent loses 1 life.
Equip {2}","Arma viva (Quando este Equipamento entrar no campo de batalha, crie uma ficha de criatura preta 0/0 do tipo Germe Phyrexiano e anexe-a a ele.)<br>A criatura equipada recebe +1/+1.<br>Sempre que a criatura equipada ataca, cada oponente perde 1 ponto de vida.<br>Equipar {2}"
90,Emperor of Bones,"At the beginning of combat on your turn, exile up to one target card from a graveyard.
{1}{B}: Adapt 2.
Whenever one or more +1/+1 counters are put on Emperor of Bones, put a creature card exiled with Emperor of Bones onto the battlefield under your control with a finality counter on it. It gains haste. Sacrifice it at the beginning of the next end step.","No início do combate no seu turno, exile até um card alvo de um cemitério.<br>{1}{B}: Adaptação 2.<br>Toda vez que um ou mais marcadores +1/+1 forem colocados em Imperador dos Ossos, coloque no campo de batalha sob seu controle um card de criatura exilado com Imperador dos Ossos com um marcador de finalidade. Ganha ímpeto. Sacrifique-o no início da próxima etapa final."
95,Flare of Malice,"You may sacrifice a nontoken black creature rather than pay this spell's mana cost.
Each opponent sacrifices a creature or planeswalker with the greatest mana value among creatures and planeswalkers they control.",Você pode sacrificar uma criatura preta que não seja uma ficha em vez de pagar o custo de mana desta mágica.<br>Cada oponente sacrifica uma criatura ou planeswalker com o maior valor de mana entre as criaturas e planeswalkers que ele controla.
97,Grim Servant,"Menace
When Grim Servant enters the battlefield, search your library for a card with mana value less than or equal to your devotion to black, reveal it, put it into your hand, then shuffle. You lose 3 life. (Each {B} in the mana costs of permanents you control counts toward your devotion to black.)","Ameaça<br>Quando Grim Servant entrar no campo de batalha, procure em seu grimório por um card com valor de mana menor ou igual à sua devoção ao preto, revele-o, coloque-o em sua mão e depois embaralhe. Você perde 3 pontos de vida. (Cada {B} nos custos de mana das permanentes que você controla conta para sua devoção ao preto.)"
98,Kami of Jealous Thirst,"Deathtouch
{4}{B}: Each opponent loses 2 life and you gain 2 life. This ability costs {4}{B} less to activate if you've drawn three or more cards this turn. Activate only once each turn.",Toque da morte<br>{4}{B}: Cada oponente perde 2 pontos de vida e você ganha 2 pontos de vida. Esta habilidade custa {4}{B} a menos para ser ativada se você tiver comprado três ou mais cards neste turno. Ative apenas uma vez em cada turno.
100,Marionette Apprentice,"Fabricate 1 (When this creature enters the battlefield, put a +1/+1 counter on it or create a 1/1 colorless Servo artifact creature token.)
Whenever another creature or artifact you control is put into a graveyard from the battlefield, each opponent loses 1 life.","Fabricar 1 (Quando esta criatura entrar no campo de batalha, coloque um marcador +1/+1 nela ou crie uma ficha de criatura artefato incolor 1/1 do tipo Servo.)<br>Toda vez que outra criatura ou artefato que você controla é colocado num cemitério vindo do campo de batalha, cada oponente perde 1 ponto de vida."
103,Nethergoyf,"Nethergoyf's power is equal to the number of card types among cards in your graveyard and its toughness is equal to that number plus 1.
Escape—{2}{B}, Exile any number of other cards from your graveyard with four or more card types among them. (You may cast this card from your graveyard for its escape cost.)","O poder de Nethergoyf é igual ao número de tipos de card entre os cards em seu cemitério e sua resistência é igual a esse número mais 1.<br>Escapatória — {2}{B}, Exile qualquer número de outros cards de seu cemitério com quatro ou mais tipos de card entre eles. (Você pode conjurar este card de seu cemitério pagando seu custo de escapatória.)"
108,Scurrilous Sentry,"Menace
Whenever Scurrilous Sentry enters the battlefield or attacks, it connives. (Draw a card, then discard a card. If you discarded a nonland card, put a +1/+1 counter on this creature.)","Ameaça<br>Sempre que Sentinela Scurrilous entra no campo de batalha ou ataca, ela é conivente. (Compre um card e depois descarte um card. Se você descartou um card que não seja um terreno, coloque um marcador +1/+1 nesta criatura.)"
110,Warren Soultrader,"Pay 1 life, Sacrifice another creature: Create a Treasure token. (It's an artifact with ""{T}, Sacrifice this artifact: Add one mana of any color."")","Pague 1 ponto de vida, sacrifique outra criatura: Crie uma ficha de Tesouro. (É um artefato com ""{T}, sacrifique este artefato: Adicione um mana de qualquer cor."")"
112,Wurmcoil Larva,"Deathtouch, lifelink
When Wurmcoil Larva dies, create a 1/2 black Phyrexian Wurm artifact creature token with deathtouch and a 2/1 black Phyrexian Wurm artifact creature token with lifelink.","Toque mortífero, vínculo com a vida<br>Quando Larva Espiral de Wurm morrer, crie uma ficha de criatura artefato preta 1/2 do tipo Vorme Phyrexiano com toque mortífero e uma ficha de criatura artefato preta 2/1 do tipo Vorme Phyrexiano com vínculo com a vida."
114,Amped Raptor,"First strike
When Amped Raptor enters the battlefield, you get {E}{E} (two energy counters). Then if you cast it from your hand, exile cards from the top of your library until you exile a nonland card. You may cast that card by paying an amount of {E} equal to its mana value rather than paying its mana cost.","Primeiro ataque<br>Quando Amped Raptor entra no campo de batalha, você recebe {E}{E} (dois marcadores de energia). Então, se você conjurá-lo de sua mão, exile cards do topo de seu grimório até exilar um card que não seja um terreno. Você pode conjurar aquele card pagando uma quantia de {E} igual ao seu valor de mana em vez de pagar seu custo de mana."
116,Detective's Phoenix,"Bestow—{R}, Collect evidence 6. (To pay this bestow cost, pay {R} and exile cards with total mana value 6 or greater from your graveyard.)
Flying, haste
Enchanted creature gets +2/+2 and has flying and haste.
You may cast Detective's Phoenix from your graveyard using its bestow ability.","Agraciar — {R}, Colete evidências 6. (Para pagar este custo de agraciar, pague {R} e exile cards com valor de mana total igual ou superior a 6 de seu cemitério.)<br>Voar, impeto<br>A criatura encantada recebe +2/+2 e tem voar e impeto.<br>Você pode conjurar a Fênix do Detetive de seu cemitério usando sua habilidade de conceder."
119,Flare of Duplication,"You may sacrifice a nontoken red creature rather than pay this spell's mana cost.
Copy target instant or sorcery spell. You may choose new targets for the copy.",Você pode sacrificar uma criatura vermelha que não seja uma ficha em vez de pagar o custo de mana desta mágica.<br>Copie a mágica instantânea ou feitiço alvo. Você pode escolher novos alvos para a cópia.
120,Frogmyr Enforcer,"Prototype {3}{R} — 2/2 (You may cast this spell with different mana cost, color, and size. It keeps its abilities and types.)
Affinity for artifacts (This spell costs {1} less to cast for each artifact you control.)","Protótipo {3}{R} — 2/2 (Você pode conjurar esta mágica com custo de mana, cor e tamanho diferentes. Ela mantém suas habilidades e tipos.)<br>Afinidade com artefatos (Este feitiço custa {1} a menos para ser conjurado para cada artefato que você controla.)"
124,Glimpse the Impossible,"Exile the top three cards of your library. You may play those cards this turn. At the beginning of the next end step, if any of those cards remain exiled, put them into your graveyard, then create a 0/1 colorless Eldrazi Spawn creature token for each card put into your graveyard this way. Those tokens have ""Sacrifice this creature: Add {C}.""","Exile os três cards do topo do seu grimório. Você pode jogar essas cartas neste turno. No início da próxima etapa final, se algum desses cards permanecer exilado, coloque-o em seu cemitério e, em seguida, crie uma ficha de criatura incolor 0/1 do tipo Prole Eldrazi para cada card colocado em seu cemitério dessa forma. Essas fichas têm “Sacrifique esta criatura: Adicione {C}”."
127,Mogg Mob,"Sacrifice Mogg Mob: It deals 3 damage divided as you choose among one, two, or three targets.","Sacrifique Mogg Mob: Causa 3 pontos de dano divididos conforme você escolhe entre um, dois ou três alvos."
